2020-05-04 18:59:16,"b""#Coronavirus #Politics Daily: #Zimbabwe's plea, #Gaza's unexpected boom, #Bangladesh's terrible #dilemma https://t.co/lafpt12E1q""","Dhaka, Bangladesh",-0.3,0.6666666666666666
2020-05-04 18:57:42,"b'Privacy concerns remain over contact-tracing app, Amnesty International UK says https://t.co/dNhT6phNx9 #labour #politics #JC4PM'",Cornwall,0.0,0.0
2020-05-04 18:57:11,b'@CBRE #economist @SpencerGLevy tells @NAIOPSouthFL that #affordablehousing issues are critical to the future health\xe2\x80\xa6 https://t.co/h9KoTgA0We',South Florida,0.0,0.4625
2020-05-04 18:56:58,b'Joe Biden has met his moment. America needs him now more than ever.\nhttps://t.co/kDkdKEv4z6\n+1 FoggyBot #LeftWing #Politics',Internet,0.5,0.5
2020-05-04 18:55:15,b'Media Runs With Totally Misleading Narrative About Trump\xe2\x80\x99s Lincoln Comparison https://t.co/8mwyDNbIpv #politics\xe2\x80\xa6 https://t.co/MLj2ysTFy5',United States,0.0,0.75
2020-05-04 18:55:02,b'Prime Minister announces ban on assault-style firearms  @GouvQc  - https://t.co/dmbL0wyXpb #Ontario #Politics',Terrebonne,0.0,0.0
2020-05-04 18:54:34,b'this is possibly the most succinct political assessment of modern times @CyrusMMcQueen #Savage #politics #fucktrump\xe2\x80\xa6 https://t.co/n3Fbw6HqsV',Brooklyn,0.175,0.47500000000000003
2020-05-04 18:54:33,"b'If Joe Biden Actually Wants to Clean Out the Stables, Elizabeth Warren Is the...\nhttps://t.co/GxXdL8nJPE\n+1 CultureBot #LeftWing #Politics'",Internet,0.2833333333333333,0.4
2020-05-04 18:54:26,b'HUGE REVELATION: Latest DOJ Documents Released In Flynn Case Reveal Obama White House Was Running the Operation\xe2\x80\xa6 https://t.co/sH8535g9ce',UK,0.30000000000000004,0.6
2020-05-04 18:54:19,b'UK names government scientific advisers after calls for transparency\nhttps://t.co/DKjIkjxQWY\n+1 EuroBot #europe #politics',Internet,0.0,0.0
2020-05-04 18:54:08,b'The Four Ways Trump Can Use to Ensure Mike Flynn Avoids Accountability for Hi...\nhttps://t.co/DFzWArhq4T\n+1 LeftyBot #LeftWing #Politics',Internet,0.0,0.0
2020-05-04 18:53:37,"b'Deep State In Effort To hide their Dirt plans to Block Investigation into Chinese Coronavirus Origins, Tax Money to\xe2\x80\xa6 https://t.co/vkiHOBzAiL'",UK,0.0,0.2
2020-05-04 18:52:36,b'War Room: Pandemic EP 160  #CitizensAR #CitizensOfTheAmericanRepublic #COAR #SteveBannon #WarRoomImpeachment\xe2\x80\xa6 https://t.co/CcFWLDmEAg',"Glens Falls, NY",0.0,0.0
2020-05-04 18:52:29,b'Drops 5/2+3 Targt Painted  #SpaceShot76 #WorldPatriotNews #GreatAwakening #VoteRed #FISAGate #TrumpPence2020\xe2\x80\xa6 https://t.co/JRqe7cyUIh',"Glens Falls, NY",0.0,0.0
2020-05-04 18:52:13,b'Not Everyone Can Vote by Mail. Here\xe2\x80\x99s How to Conduct a Safe Election.\nhttps://t.co/HcyVlMapJ1\n+1 LeftyBot #LeftWing #Politics',Internet,0.5,0.5
2020-05-04 18:49:48,b'The book that never ends is called my timeline.\n\n#Psychoanalysis #Philosophy #Politics #Theory #Baudrillard\xe2\x80\xa6 https://t.co/nTPiXwjSrL',"Cleveland, OH",0.0,0.0
2020-05-04 18:49:36,b'The more the merrier I say #IndyWales #CymruRhyddASAP #politics #Memes #Wales #Cymru https://t.co/3TcWVddyBp',"Catalonia, Spain",0.5,0.5
2020-05-04 18:49:28,b'Watch as guest host @BradBannon interviews world-renowned infectious disease Dr. Bob Bollinger of @HopkinsMedicine\xe2\x80\xa6 https://t.co/ZgEnClzDZp',"Los Angeles, CA",0.0,0.0
2020-05-04 18:49:18,"b'Wonderful zoom talk by Mr.Annamalai, Former #IPS Officer on topics ranging from education, spirituality, individual\xe2\x80\xa6 https://t.co/OmMbjyUETe'","Salem, Tamilnadu, India",0.5,0.5
2020-05-04 18:48:47,"b'The #Biden/#Reade plot thickens.  Also - did #JoeBiden expect this request to be rejected due to ""strict [legal] co\xe2\x80\xa6 https://t.co/UyL4MHppmG'","Riverdale Park, MD ",0.037500000000000006,0.2875
2020-05-04 18:48:02,"b'Running For Public Office?\n\nQ? \n\nMaybe You REALISE You Wont Recieve Media Coverage, and it\xe2\x80\x99s stacked against you,\xe2\x80\xa6 https://t.co/DLctdOrghq'","Kansas City, MO",0.0,0.06666666666666667
2020-05-04 18:47:43,b'Exclusive: Internal Chinese report warns Beijing faces Tiananmen-like global backlash over virus \xe2\x80\x93 sources\xe2\x80\xa6 https://t.co/xTpNvtRXGH',South Africa; Cape Town,0.0,0.0
2020-05-04 18:47:30,"b""Concerning the wear of #mask, let's all be careful. #London #Manchester #Africa #NEWS #politics #covid #confinement\xe2\x80\xa6 https://t.co/JmMvsD1KPB""",Lyon,-0.1,1.0
2020-05-04 18:47:22,b'Reason:  8 Possible Reasons for the Huge International Differences in COVID-19 Deaths https://t.co/D4a7gK4lLn\xe2\x80\xa6 https://t.co/aGextq3DNO',Maryland,0.13333333333333336,0.6333333333333333
2020-05-04 18:47:13,b'Trump supporter tells president to stop \xe2\x80\x98bullying\xe2\x80\x99 and answer questions directly during Fox News town hall\xe2\x80\xa6 https://t.co/mNnEKvRV2U',,0.1,0.4
2020-05-04 18:47:04,"b'We need more of our Black elite, influencers to turn political to help organize to give our voices a platform to ch\xe2\x80\xa6 https://t.co/rukfc233CH'","California, USA",0.11111111111111112,0.3444444444444445
2020-05-04 18:46:40,b'@rushlimbaugh just said that #nfl #quarterbacks have an IQ of 8. Maybe stick to #Conservative #politics and leave\xe2\x80\xa6 https://t.co/etUOkcF3t9',Seattle,0.0,0.0
2020-05-04 18:46:04,"b'""#Politics News: What this year\xe2\x80\x99s election campaign will look like online #News"" #StayHomeSaveLives: https://t.co/OGf2yiLqYB'",RT's Are FYI Purposes Only,0.0,0.0
2020-05-04 18:45:46,b'Is #Administrative #Law #Immoral? https://t.co/Jl7QEVWQK8\n\nGreat #reporting on the real issues of decay in #USA\xe2\x80\xa6 https://t.co/SJdwUGI2rd',"Alabama, USA",0.5,0.525
2020-05-04 18:44:10,"b'PLEASE help us get over 10,000 hits today... @GovJVentura We need you NOW Jesse, to lead this MOVEMENT... Please, p\xe2\x80\xa6 https://t.co/rL5mYomgtE'",Shoreline Connecticut,0.0,0.0
2020-05-04 18:43:47,"b""Coronavirus: Scientists hail 'groundbreaking' discovery of antibody which prevents infection \xe2\x80\x93 SKY By @ross_burland\xe2\x80\xa6 https://t.co/RbEr96xIGz""",Barcelona,0.0,0.0
2020-05-04 18:43:27,"b'Trump can go on and on about how well we\xe2\x80\x99re handling the pandemic, but until we get him out of office there might a\xe2\x80\xa6 https://t.co/4767wj9iLe'",,0.0,0.0
2020-05-04 18:42:56,"b""This was honest, necessary &amp; brutal.\n\xe2\x9e\xa1\xef\xb8\x8f CNN's Don Lemon slammed Trump's response to a unifying message from George\xe2\x80\xa6 https://t.co/ecv1xFDOXK""",Seattle,-0.09166666666666667,0.9666666666666667
2020-05-04 18:42:53,"b'New research uses emails to open a window into presidential campaign intensity and strategy. Jeff Broxmeyer,\xe2\x80\xa6 https://t.co/oYvZWZYpRb'","Toledo, OH",0.06818181818181818,0.4772727272727273
2020-05-04 18:42:25,"b'When you fundraise with Raise The Money, your donors\xe2\x80\x99 data is safe and isn\xe2\x80\x99t shared with any other candidate or com\xe2\x80\xa6 https://t.co/dfYB8fu4rK'",DC | Little Rock | Vegas,0.1875,0.4375
2020-05-04 18:42:05,"b'While Trump Lies About \xe2\x80\x98Great Reviews\xe2\x80\x99 for Pandemic Response, His Admin Projects 3,000 Deaths per Day\xe2\x80\xa6 https://t.co/O4cXLcAYR6'","27.098506,-80.150956",0.8,0.75
2020-05-04 18:41:01,"b'Check out Lot 8 Life Magazine Nixon, Russia ,Ted Kennedy, Eisenhower, Diana Ross China 60s  https://t.co/R2FAIpzY2E\xe2\x80\xa6 https://t.co/TzHxzoeaia'","Ventura, Iowa",0.0,0.0
2020-05-04 18:40:54,"b'RoseAnn we have a chance NOW for a big start @GovJVentura We need you NOW Jesse, to lead this MOVEMENT... Please, p\xe2\x80\xa6 https://t.co/enr8cOoDjU'",Shoreline Connecticut,0.0,0.1
2020-05-04 18:40:27,b'Missing the west wing right about now. Feel like Bartlet might have some different ideas about how to handle this p\xe2\x80\xa6 https://t.co/oUO1idBeWr',,0.028571428571428564,0.3952380952380952
2020-05-04 18:38:53,"b'@GovJVentura We need you NOW Jesse, to lead this MOVEMENT... Please, please RUN NOW... please retweet\xe2\x80\xa6 https://t.co/wOjKraleBQ'",Shoreline Connecticut,0.0,0.0
2020-05-04 18:38:47,"b'I ""love"" how Conservative media has been pretending that Corona Virus is not a problem and is encouraging people to\xe2\x80\xa6 https://t.co/CJVY1MqbFs'",Italy,0.5,0.6
2020-05-04 18:38:39,b'White House faces bad news on lockdown results https://t.co/OCKD2neAaS via #FoxNews #Politics',"Miami, Florida",-0.3499999999999999,0.3333333333333333
2020-05-04 18:38:16,b'Protesters are gathered in a tightly-packed group outside the gate of the State House to push @MassGovernor to reop\xe2\x80\xa6 https://t.co/XhYGLOtupq',"Boston, MA",0.0,0.05
2020-05-04 18:38:02,b'@WayneDupreeShow @SuzyK1954 Beauty is definitely in the \xe2\x80\x9ceye of the beholder\xe2\x80\x9d.  #Politics',"wichita, kansas",0.0,0.5
2020-05-04 18:36:49,"b'Please everybody... tweet @GovJVentura We need you NOW Jesse, to lead this MOVEMENT... Please, please RUN NOW... pl\xe2\x80\xa6 https://t.co/z7Dumg2Q5S'",Shoreline Connecticut,0.0,0.0
2020-05-04 18:36:21,b'The focus on Taiwan by the US in the #UN as 68.000 people have died in US &amp; US is spoiler in UN SecCouncil on draft\xe2\x80\xa6 https://t.co/boM3srNzqJ',passblue1@gmail.com,0.0,0.0
2020-05-04 18:36:09,"b'#Politics, #TheNewAbnormal in #TheAgeOfTheTrumpSewer #MorallyBankrupt @GOP #Moscow @WhiteHouse: An Animated Introdu\xe2\x80\xa6 https://t.co/98X5Nb4fCL'",USA & World,0.0,0.0
2020-05-04 18:35:50,"b'@GovJVentura @GovJVentura We need you NOW Jesse, to lead this MOVEMENT... Please, please RUN NOW...\xe2\x80\xa6 https://t.co/Tn8t2VDVDT'",Shoreline Connecticut,0.0,0.0
2020-05-04 18:35:44,"b'Live: Catholics for Trump with Mercedes &amp; Matt Schlapp, Justin Clark, Mary Matalin, and MORE\xe2\x80\xa6 https://t.co/ncrOxSk9as'",DC,0.13636363636363635,0.5
2020-05-04 18:35:25,b'Renewable Energy: Generating Money https://t.co/pM4xRgmQZR #politics https://t.co/vSYK8J44Sr',"England, United Kingdom",0.0,0.0
2020-05-04 18:34:51,"b""Do you ever act with #violence?\nA) Never\nB) Only in self defense\nC) Sometimes\nD) Yes if someone f's with me or disr\xe2\x80\xa6 https://t.co/ijxiesFHOn""","Tucson, AZ",0.0,1.0
2020-05-04 18:34:32,b'(2)\xe2\x80\xa2 What does this economic formation achieve that other formations do not?\n\n#Psychoanalysis #Philosophy #Politics\xe2\x80\xa6 https://t.co/1okkSF7olO',"Cleveland, OH",0.037500000000000006,0.2875
2020-05-04 18:33:25,b'\xe2\x80\x9cWhiteness and patriarchy created a web in which the vast majority of humanity was ensnared and cordoned off from t\xe2\x80\xa6 https://t.co/wVYtZEwTOo',Seattle WA,0.0,1.0
2020-05-04 18:33:13,"b'WE NEED YOU JESSE!!!!! @GovJVentura We need you NOW Jesse, to lead this MOVEMENT... Please, please RUN NOW... pleas\xe2\x80\xa6 https://t.co/qBwXczHxRJ'",Shoreline Connecticut,0.0,0.0
2020-05-04 18:32:26,b'Putin on Trump.. meglomaniac LOVE HATE POLL https://t.co/Eg3RqfHXUc #politics #satire 1',The seventh house ,-0.15000000000000002,0.75
2020-05-04 18:32:22,b'Reason:  Who Should Pay the Rent During a Pandemic? https://t.co/gyhuVVYW95 #Gop2012 #Tcot #Tlot #jobs #polls\xe2\x80\xa6 https://t.co/Xc6ysUj8gn',Maryland,0.0,0.0
2020-05-04 18:31:23,"b'Internal FEMA document projects spike in daily coronavirus death toll, but data questioned https://t.co/5ChkmXTIkx via #FoxNews #Politics'","Miami, Florida",0.0,0.0
2020-05-04 18:31:23,"b""One Hundred and Forty-Second Amendment - Don't Poke the Bear  https://t.co/qofmUKwSrk  #politics #republican\xe2\x80\xa6 https://t.co/31nFrf2Nk4""","Brisbane, Queensland",0.0,0.0
2020-05-04 18:31:18,"b'Should the #25thAmendment be used to remove #PresidentTrump from office due to lack of #sanity?\nA) No, he is mental\xe2\x80\xa6 https://t.co/C7fu1K7h3F'","Tucson, AZ",-0.125,0.375
2020-05-04 18:30:47,b'BREAKING: VIDEO NYPD Brutal Selective Enforcement #SocialDistancing attack #nyc #black and #hispanic residents. We\xe2\x80\xa6 https://t.co/93tlcxYAzP',"New York, NY",-0.5208333333333334,0.7166666666666667
2020-05-04 18:30:07,b'Shop your values AND #GroceryShop your values too! Do these grocery stores support your values? Download our chrome\xe2\x80\xa6 https://t.co/CNtdcWOb5r',,0.0,0.0
2020-05-04 18:30:06,"b""'It was so incredibly stupid that it sounded like a comedy skit. Take a bow CNN, you\xe2\x80\x99re the fakest name in news.'\xe2\x80\xa6 https://t.co/54m6Pb8eRL""",United States,-0.7999999999999999,1.0
2020-05-04 18:28:26,"b""Listen to 'Deadline D.C. with @BradBannon' 3-4pm ET on @NRMStreamcast.\nFirst @HopkinsMedicine's Dr. Bob Bollinger o\xe2\x80\xa6 https://t.co/KaHD8NlYma""","Los Angeles, CA",0.25,0.3333333333333333
2020-05-04 18:28:17,"b""As this goes on..I just don't see them as Republicans. This mutant body of followers use the name Republican. And I\xe2\x80\xa6 https://t.co/bgyENQVujV""",WA,0.0,0.0
2020-05-04 18:28:08,b'#Coronavirus: What does it mean when the #UKGovernment says it is \xe2\x80\x98following the science\xe2\x80\x99? | @PMPmagToday\n\n#Covid19\xe2\x80\xa6 https://t.co/WMExz8S54p',Politics Means Politics™,-0.15625,0.39375
2020-05-04 18:24:29,b'DONALD TRUMP\nHand-Signed authentic #autograph Copy of ARTICLES OF IMPEACHMENT * Souvenir * Beckett Authenticated:\xe2\x80\xa6 https://t.co/dSSpVymsDm',,0.5,0.75
2020-05-04 18:23:49,"b""I read a post stating we are all #disconnecting; I agree, but I'm doing my best to stay connected with #people bc I\xe2\x80\xa6 https://t.co/jmBXjTmaqC""",,1.0,0.3
2020-05-04 18:23:46,"b""How to listen to Supreme Court's oral arguments amid coronavirus https://t.co/pM8RKWmjh6 via #FoxNews #Politics""","Miami, Florida",0.0,0.0
2020-05-04 18:23:45,"b""Counties defying state coronavirus 'stay-at-home' orders and reopening for business https://t.co/DXsq3RNj79 via #FoxNews #Politics""","Miami, Florida",0.0,0.0
2020-05-04 18:23:41,b'(4)\xe2\x80\xa2 Subjectivity always ends in deadlock productivity\n\xe2\x80\xa2 Adaptivity within deadlocks is the only way to cope with d\xe2\x80\xa6 https://t.co/F4DJ0bEpVQ',"Cleveland, OH",0.0,1.0
2020-05-04 18:21:26,b'Trump Drops the Hammer on Fauci After Disturbing White House Briefings on Doctor\xe2\x80\x99s Past https://t.co/mgYsEwvRcg #POLITICS',,-0.25,0.35000000000000003
2020-05-04 18:20:50,b'@naval @pollscout track #politics',🌏,0.0,0.0
2020-05-04 18:19:35,b'\xe2\x80\x98I\xe2\x80\x99ll make something up\xe2\x80\x99: UK cop suspended after video catches him threatening to fabricate charge against man and\xe2\x80\xa6 https://t.co/Yp9huoqOh1',At Your Fingertips,0.0,0.0
2020-05-04 18:18:48,"b'Deep State In Effort To hide their Dirt plans to Block Investigation into Chinese Coronavirus Origins, Tax Money to\xe2\x80\xa6 https://t.co/OUn7y7u3A8'",,0.0,0.2
2020-05-04 18:18:12,"b'#Politics &amp; #HEROES in #TheAgeOfTheTrumpSewer #MorallyBankrupt @GOP #Moscow @WhiteHouse: When Gov Fails, Makers Com\xe2\x80\xa6 https://t.co/AVcQECbtXD'",USA & World,-0.5,0.3
2020-05-04 18:17:18,"b""@wiseunclebuck @Chica_LeoLatina Same here Buck. This is the most engaged with #Politics that I've EVER been! I've a\xe2\x80\xa6 https://t.co/T59QP2wtxV""",United States,0.3125,0.3125
2020-05-04 18:16:54,b'Reason:  How to Track COVID-19 Without Mass Surveillance https://t.co/zL4nTDYwZO #Gop2012 #Tcot #Tlot #jobs #polls\xe2\x80\xa6 https://t.co/KGOmwCIeFa',Maryland,0.0,0.0
2020-05-04 18:15:24,"b'\xe2\x80\x9cScientists \xe2\x80\x98puzzled by Florida\xe2\x80\x99\xe2\x80\x9d expected nothing less from my home state. The world, take note! \xf0\x9f\xa4\xa3 #COVID\xe3\x83\xbc19\xe2\x80\xa6 https://t.co/Q6A03QYKPZ'","London, England",-0.15416666666666667,0.23333333333333334
2020-05-04 18:13:17,"b'Governorships in play are (mostly) seeing relatively modest political ad spending\n\nThe state of the state races, an\xe2\x80\xa6 https://t.co/R3fGHb0l4k'",México City,0.19999999999999998,0.5
2020-05-04 18:13:16,b'Discussing the philosophy of Consequentialism and Utilitarianism. \n\nStory:\n\n#podcast #podernfamily #podcasting\xe2\x80\xa6 https://t.co/zeM7w5yusN',,0.0,0.0
2020-05-04 18:11:39,"b'New Jersey schools to stay closed for remainder of academic year, governor says https://t.co/nI1ejy3Rql via #FoxNews #Politics'","Miami, Florida",0.012121212121212116,0.18484848484848485
2020-05-04 18:10:37,b'Mayor Duggan #COVID19 Press Briefing Live https://t.co/ttHIEFT7es #DCTV #Health #News #USA #Detroit #Michigan\xe2\x80\xa6 https://t.co/DWTs3k9HCl',Detroit,0.13636363636363635,0.5
2020-05-04 18:10:13,b'Chicago Mayor Lori Lightfoot Suggests People Who Promote Gatherings On Social Media Will Face Legal Action\xe2\x80\xa6 https://t.co/oaZys5wNtl',United States,0.11666666666666667,0.13333333333333333
2020-05-04 18:10:13,"b'Blount County Sheriff Moon denies opposing, defying Ivey \xe2\x80\x94 Says he will not jail or cite church violators, business\xe2\x80\xa6 https://t.co/tVTIQDa9mG'","Miami, FL",0.05,0.0
2020-05-04 18:10:12,b'#Politics &amp; #HEROES in #TheAgeOfTheTrumpSewer #MorallyBankrupt @GOP #Moscow @WhiteHouse: Tennessee group makes face\xe2\x80\xa6 https://t.co/HZkRY1epDD',USA & World,0.0,0.0
2020-05-04 18:09:34,b'FCC commissioner unleashes vicious Twitter thread asking China to \xe2\x80\x98un-disappear\xe2\x80\x99 people who spoke out against the c\xe2\x80\xa6 https://t.co/Rbme4gvV3O',At Your Fingertips,-1.0,1.0
2020-05-04 18:09:06,b'Coronavirus lockdown: Ministers outline Covid-19 exit strategy - inews #politics https://t.co/7gEiGh8uYD https://t.co/v0ZjBzgoiG',United Kingdom,0.0,0.0
2020-05-04 18:09:05,b'#BEWARE #USA Citizens. PC/Leftest #democrats partner with MILITARY folks 2 Control free thinking/speech\xe2\x80\xa6 https://t.co/7OOo8AZFA7',"Main Street, USA",0.15000000000000002,0.45
2020-05-04 18:09:05,b'Teens charged with murdering NHS worker days after his dad died - https://t.co/FJYEXRIY1y #politics\xe2\x80\xa6 https://t.co/uRHDbbrQyU',United Kingdom,0.0,0.0
2020-05-04 18:09:03,"b""Pompeo says shots fired by North Korea aross its border towards the South were 'accidental' - Daily Mail #politics\xe2\x80\xa6 https://t.co/rBU3NQlf1S""",United Kingdom,0.0,0.0
2020-05-04 18:09:02,b'Coronavirus: Under-fire insurers hold secret talks over \xc2\xa3100m fund for stricken charities - Sky News #politics\xe2\x80\xa6 https://t.co/F7O5hU1unJ',United Kingdom,-0.4,0.7
2020-05-04 18:08:58,b'Biden isn\xe2\x80\x99t an altruist\xe2\x80\x94- his defense team would need the same records! #politics',he/him; 🇺🇸 ,0.0,0.125
2020-05-04 18:07:57,"b'Trump Administration model projects daily coronavirus death toll will increase to 3,000 by June - CNN #Politics\xe2\x80\xa6 https://t.co/L3DVImupzK'","Washington, DC",0.0,0.0
2020-05-04 18:07:06,"b'Rishi Kapoor\xe2\x80\x99s ashes immersed in Banganga: Neetu, Ranbir Kapoor, Alia Bhatt, Riddhima bid tearful a... - Hindustan\xe2\x80\xa6 https://t.co/6CZuX2ixyY'",India,0.0,0.0
2020-05-04 18:07:05,b'Salman Khan provides truck full of food supplies for COVID-19 relief while being at his Panvel farmhouse - Times of\xe2\x80\xa6 https://t.co/XUB1VKCCLU',India,0.35,0.55
2020-05-04 18:07:03,"b'First Case of African Swine Flu Detected in India; 2,500 Pigs Killed in Assam - News18 #politics\xe2\x80\xa6 https://t.co/rHVFHIn3Ai'",India,0.016666666666666663,0.1111111111111111
2020-05-04 18:06:45,b'@DC_Draino @DineshDSouza This marriage is doomed. Clearly #leftist parents choosing #Politics over their daughter.',"Georgia, USA",-0.05,0.6
2020-05-04 18:05:39,"b""Compare the news side-by-side to see who's telling the whole story. Comment on bias or under-reporting. Share to su\xe2\x80\xa6 https://t.co/L2l8BWtHSi""",,0.2,0.4
2020-05-04 18:04:25,b'This is unfortunate that we have opposition @INCIndia who only believe in  #Dividing #Misguiding #FakeNews #Hatred\xe2\x80\xa6 https://t.co/73W6q7ux0i',Mumbai,-0.25,1.0
2020-05-04 18:03:37,b'@njdotcom Enough #opennj  entirely.  This is nothing but #politics by @NJSenatePres @GovMurphy @NJSenDems and you w\xe2\x80\xa6 https://t.co/gC2oB8I6We',,0.0,0.5625
2020-05-04 18:03:04,"b'@ItsMutai Also Bitter Truth, Gideon even with the name Moi is not a man equal to William (@WilliamsRuto), Bill is a\xe2\x80\xa6 https://t.co/VZqwtnCTE9'","Nairobi, Kenya",-0.05,0.375
2020-05-04 18:01:35,b'He has failed the American people and the American working class #GOP #algop #AlSen #alpolitics #politics https://t.co/DOEnwsH9NJ',,-0.16666666666666666,0.09999999999999999
2020-05-04 18:01:06,b'Covid 19 crisis in India needs a human face in governance\n#CoronavirusOutbreak #IndiaFightsCorona\xe2\x80\xa6 https://t.co/sNh1naOXy9',,0.0,0.1
2020-05-04 18:01:06,b'@jayantsinha @HazaribagPolice @JharkhandPolice @jayantsinha @DC_Hazaribag i am totally agree that if dealer is doin\xe2\x80\xa6 https://t.co/LzFkJoT5AV',"Bengaluru,India",0.0,0.75
2020-05-04 18:00:43,"b""Biblical Christianity isn't about winning political battles. It's about following &amp; obeying Jesus &amp; humbly serving\xe2\x80\xa6 https://t.co/cvECzRqZWk""","Nashville, Tennessee, USA",0.075,0.3375
2020-05-04 18:00:42,"b'#Politics,#TheNewAbnormal in #TheAgeOfTheTrumpSewer #MorallyBankrupt @GOP #Moscow @WhiteHouse: COVID19 stimulus wen\xe2\x80\xa6 https://t.co/77lSRehPFw'",USA & World,0.0,0.0
2020-05-04 18:00:03,b'#Politics @Interior Secretary of the Interior David Bernhardt: Maintaining Public Access for Public Health https://t.co/rBaMhjTn5s',"New York, NY #manhattan #usa ",0.0,0.06666666666666667
2020-05-04 17:59:02,"b'The public does not understand what a 0.5 mortality rate means, when 100% of us have been exposed to the virus, ove\xe2\x80\xa6 https://t.co/ioxUkRA1An'","Los Angeles, CA",0.0,0.06666666666666667
2020-05-04 17:58:23,"b'Tune in TODAY @6pm CST where we Reveal Reality to our people, Precept Upon Precept. This week\xe2\x80\x99s topic is Overt Raci\xe2\x80\xa6 https://t.co/pAEOw2R2Mh'",,0.0,0.0
2020-05-04 17:58:08,b'WATCH: Cynthia McKinney: We Are Being LIED To! - IS THIS Civil War 2.0?\nhttps://t.co/CgxxAUDYPe\n\n#news #coronavirus\xe2\x80\xa6 https://t.co/8bRp9LBNc0',,0.0,0.0
2020-05-04 17:57:39,b'Do we need more or can we survive with less? There is no question that we are in the midst of a major catastrophe w\xe2\x80\xa6 https://t.co/YKcUdLx6X3',"Toronto, Ontario",0.13194444444444445,0.35555555555555557
2020-05-04 17:56:06,"b'Amidst economic turmoil, a new Bank of Canada Governor \n#Canada  #Economy  #Politics  #BankofCanada  #finance\xe2\x80\xa6 https://t.co/hkC9OIkpMH'",Canada,0.16818181818181818,0.32727272727272727
2020-05-04 17:55:46,b'How many people have to die for you to believe the virus is killing us? There are 68K dead and growing the US popul\xe2\x80\xa6 https://t.co/ffk1aU0fGK',"Los Angeles, CA",0.15,0.45
2020-05-04 17:55:36,b'#Coronavirus: Daily fees for #peers will be halved to reflect changes to working practices due to the coronavirus\xe2\x80\xa6 https://t.co/SmSBj1tbwN',UK,-0.0625,0.1875
2020-05-04 17:55:21,b'\xf0\x9f\x94\xb4 LIVE PODCAST: NOTFlix Season One Episode 17 - 0 for FORTY! on @Spreaker #bible #covid19 #life #politics #religion https://t.co/BycVTQLjNB',United States,0.17045454545454544,0.5
2020-05-04 17:55:09,"b'DOJ Supports Church Suing Virginia Gov. Northam For Threatening Fines, Imprisonment Of Pastor\xe2\x80\xa6 https://t.co/4EV13v9JUB'",United States,0.0,0.0
2020-05-04 17:54:59,b'Oyo PDP peace talks suffer setback as Ladoja pulls out - https://t.co/GJBj08uQcv #Notice #Nigeria #Naija #Politics #bbnaija',Nigeria,0.0,0.0
2020-05-04 17:54:49,b'I just did a Flyer Design for a Client! \nCheck my works here - https://t.co/iH3wWeHxug \nContact me to make one for\xe2\x80\xa6 https://t.co/7tCFQ0TlAy',,0.0,0.0
2020-05-04 17:53:49,b'Juul donated to New Jersey politicians even as they considered vaping restrictions - POLITICO https://t.co/pLsAhSFcKR #UK #Politics #News',United Kingdom,0.13636363636363635,0.45454545454545453
2020-05-04 17:53:49,b'All Politics Are Local: A closer look at reopening states &amp; a look ahead from Washington\xe2\x80\xa6 https://t.co/E0Exyp9yjP #UK #Politics #News',United Kingdom,0.0,0.0
2020-05-04 17:53:03,b'#news #politics - Pandemic: Adeyeye seeks support for govt https://t.co/XQ7UBvr30s',Lagos - Nigeria,0.0,0.0
2020-05-04 17:51:53,b'Americanization of Canada\xe2\x80\x99s Media https://t.co/VkgTSqzLIF via @YouTube #cdnpoli #USpoli #Narratives #Division #Politics',,0.0,0.0
2020-05-04 17:51:50,"b""\xe2\x80\x98Alternative Facts\xe2\x80\x99: A Psychiatrist\xe2\x80\x99s Guide to Twisted Relationships to Truth. Untruths aren't always lies. Alterna\xe2\x80\xa6 https://t.co/EqMEm3nV3F""",Base of Pikes Peak,-0.5,1.0
2020-05-04 17:51:27,b'Why Singapore\xe2\x80\x99s \xe2\x80\x9cchange of heart\xe2\x80\x9c after the blanket ban on home-based businesses? The fear of losing more Malay vot\xe2\x80\xa6 https://t.co/OTXGl6ZsGN',Singapore,0.5,0.5
2020-05-04 17:51:14,"b'Deep State In Effort To hide their Dirt plans to Block Investigation into Chinese Coronavirus Origins, Tax Money to\xe2\x80\xa6 https://t.co/dfd6F3GFMN'","Kohala Coast, Hawaii ",0.0,0.2
2020-05-04 17:47:30,"b""#Politics #Elections Always Remember biden Misled Everyone About Wife's Death, Blamed Innocent Man for Years.\xe2\x80\xa6 https://t.co/2XUEAcvg9e""","Planet Earth, Milky Way Galaxy",0.5,0.7
2020-05-04 17:47:07,"b""USC, Emory Creating Coronavirus Surveillance System Similar to China's Social Credit Scoring\xe2\x80\xa6 https://t.co/qeN0zKJode""",United States,0.016666666666666666,0.23333333333333334
2020-05-04 17:46:49,b'With participation in politics so low at the moment I think Christians should ensure their views are represented at\xe2\x80\xa6 https://t.co/6SmXiZenK1',United States,0.0,0.3
2020-05-04 17:46:22,"b'Reason:  Trump Administration Projects 200,000 American COVID-19 Deaths by June 1 https://t.co/m5Xsoy3Leo #Gop2012\xe2\x80\xa6 https://t.co/mMVpAsWSed'",Maryland,0.0,0.0
2020-05-04 17:46:04,"b'""#Politics News: #Trump takes shot at California for wanting tighter border during coronavirus pandemic #News""\xe2\x80\xa6 https://t.co/Uoy95tYzWg'",RT's Are FYI Purposes Only,0.0,0.0
