2020-05-02 23:59:55,"b'Hey all! Here\'s a post you might have missed. Read about....""The Spreading Infodemic Of Misinformation.""\xe2\x80\xa6 https://t.co/Ejj7W7q2Xw'",United States,0.0,0.0
2020-05-02 09:11:32,"b'guaranteed benefits they receive under their agreement, which they opted for at the expense of higher performance-b\xe2\x80\xa6 https://t.co/pQglowG6yn'",,0.25,0.5
2020-05-02 09:10:44,b'https://t.co/v1gUnvkKiI  \n#donald-trump #news #politics https://t.co/gLEIUb0Bgm',"Rushden, England",0.0,0.0
2020-05-02 09:10:04,b'Belarus to build new pipeline to deliver oil from Ukraine and Baltics https://t.co/7wnLmY6Gfs #Politics\xe2\x80\xa6 https://t.co/e84RXiTDp3',World,0.13636363636363635,0.45454545454545453
2020-05-02 09:10:04,b'German government predicts 6.3% drop in GDP in 2020 https://t.co/2tDfVO5gon #Politics https://t.co/eQQT8822Zi\xe2\x80\xa6 https://t.co/NKTzk2o5IR',World,0.0,0.0
2020-05-02 09:10:03,b'Trump bans use of foreign power grid equipment https://t.co/FUUHelMBXl #Politics https://t.co/eQQT8822Zi #Trump\xe2\x80\xa6 https://t.co/GuqP3Otjzl',World,-0.125,0.125
2020-05-02 09:10:02,b'India makes government tracing app mandatory for all workers https://t.co/ZMvlARdpiE #Politics\xe2\x80\xa6 https://t.co/XA71C42EEX',World,0.0,0.0
2020-05-02 09:08:22,b'Thailand and India have come to an agreement in the fight against coronavirus following a phone conversation betwee\xe2\x80\xa6 https://t.co/SnBR2tpQLJ',Thailand,0.0,0.1
2020-05-02 09:08:06,b'The neat thing is this would mean we would be able to treat the critically ill not only for #Covid_19 but for other\xe2\x80\xa6 https://t.co/wEYVFoGXWS',"Medicine Hat, Alberta",-0.078125,0.828125
2020-05-02 09:05:12,"b""Compare the news side-by-side to see who's telling the whole story. Comment on bias or under-reporting. Share to su\xe2\x80\xa6 https://t.co/4wl4FIVQ6D""",,0.2,0.4
2020-05-02 09:02:55,"b'If true, What he did, was wrong. And he should say as much. Lay it all out on the table. People make mistakes. Many\xe2\x80\xa6 https://t.co/a4lVfjTbZu'",New York City,0.016666666666666663,0.5833333333333334
2020-05-02 09:02:51,b'Shash on Hyderabad - taunting police\n\nShash on Delhi - stay safe police \n\nBhai ab maaliko pe baat aayi to stay safe\xe2\x80\xa6 https://t.co/EipFdLrn7n',India,0.5,0.5
2020-05-02 08:59:34,"b'Maryland\xe2\x80\x99s GOP governor requires citizens to wear face masks in public. If you violate the order, you could be impr\xe2\x80\xa6 https://t.co/Oy4fkYEMWz'",At Your Fingertips,0.0,0.06666666666666667
2020-05-02 08:58:09,b'Biden needs a full blown Netflix Release to kick off his campaign. Slick production is what Americans listen to. Mo\xe2\x80\xa6 https://t.co/5cGLP5cPXP',New York City,0.04999999999999999,0.4625
2020-05-02 08:56:24,"b'JUST IN: US coronavirus deaths have reached 65,000 #News #Economy #Politics'","London, England",0.0,0.0
2020-05-02 08:55:43,b'There are two types of people: those who like to follow others and those who don\xe2\x80\x99t. Neither is better than the othe\xe2\x80\xa6 https://t.co/Vwn8JfqS3G',New York City,0.5,0.5
2020-05-02 08:54:09,b'Extended Cancellation of passenger train services till 17 ... #ExtendedCancellation #passengerTrainServices\xe2\x80\xa6 https://t.co/qohbOGnCzS',Chandigarh,0.0,0.0
2020-05-02 08:53:24,"b'New guidelines for hearing of cases by CAT in #Green, Orange &amp; Red Zones #hearingOfCases #NewGuidelines\xe2\x80\xa6 https://t.co/QPWnjFFaC9'",Chandigarh,-0.02121212121212122,0.2515151515151515
2020-05-02 08:52:30,b'North Korean leader Kim Jong-un has made his first public appearance in around 20-days following speculation the dictator had died\n#Politics',Canada,0.08333333333333333,0.16666666666666666
2020-05-02 08:49:07,b'The Grim Dilemma Of Government \xe2\x96\xb8https://t.co/1VnfYe7tPP | #educate #government #politics #society #leadership',The Word of God is the Foundation of  Knowledge,-1.0,1.0
2020-05-02 08:49:00,b'Vice-chairman of the ruling Nepal Communist Party (NCP) Bamdev Gautam has reached Baluwatar to meet Prime Minister\xe2\x80\xa6 https://t.co/3bX7nSFCwu',"Kathmandu, Nepal",0.0,0.0
2020-05-02 08:45:27,b'Lebanon banks reject rescue plan for infringing on private property rights https://t.co/a0ak5YmyM5 \n\n#economy\xe2\x80\xa6 https://t.co/R95K5EFwr0',Abu Dhabi,0.0,0.375
2020-05-02 08:42:40,b'SER 201 \xe2\x80\x93 My Fame His Fame \xe2\x80\x93 Thann Bennett  #OnTheObjective #Google #VoteRed #FISAGate #TrumpPence2020 #firearms\xe2\x80\xa6 https://t.co/LgWEIXILW5',"Glens Falls, NY",0.0,0.0
2020-05-02 08:42:37,b'How Did We Get Here \xe2\x80\x93 Haircut Part Two  https://t.co/jZ2agPBI5b \n\n#economy #business #money #finance #economics\xe2\x80\xa6 https://t.co/CYjle9gL4N',Abu Dhabi,0.0,0.0
2020-05-02 08:41:32,"b'Foreign Affairs Minister Simon Coveney billed the taxpayer \xe2\x82\xac29,520 last October for public relations advice from th\xe2\x80\xa6 https://t.co/fmVyxjfyie'",Dublin,-0.041666666666666664,0.0861111111111111
2020-05-02 08:39:53,b'The coin of Life will ALWAYS turn around at some point. It keeps on FLIPPING. Lucky Dube said it in the best way po\xe2\x80\xa6 https://t.co/Bu474PX73D',"Nairobi, Kenya",0.6666666666666666,0.5666666666666667
2020-05-02 08:38:32,b'Fet amb https://t.co/mYpaBwLBsu \n\n#Politica #Politics #PoliticsToday #espanya #Espa\xc3\xb1a #politicaespanyola\xe2\x80\xa6 https://t.co/yTYmgCuhes',Sant Feliu de Llobregat,0.0,0.0
2020-05-02 08:36:49,b'Joe Biden\xe2\x80\x99s accuser .\xe2\x8e\xb0(\xe2\x88\xaa\xef\xbd\xa1\xe2\x88\xaa((( . . Tara Reade is a fledgling actress and the reason she allegedly left working in Wa\xe2\x80\xa6 https://t.co/EEgK8Etw46',"Travel: Sicily, Sweden, U.S",0.0,0.0
2020-05-02 08:35:45,b'OAN Asks White House to Intervene in Dispute With Correspondents\xe2\x80\x99 Association https://t.co/omoE5HcRVj #politics #theepochtimespolitics',DC,0.0,0.0
2020-05-02 08:35:03,b'Belarus to build new pipeline to deliver oil from Ukraine and Baltics https://t.co/7wnLmY6Gfs #Politics\xe2\x80\xa6 https://t.co/xUO7KmkECf',World,0.13636363636363635,0.45454545454545453
2020-05-02 08:35:03,b'German government predicts 6.3% drop in GDP in 2020 https://t.co/2tDfVO5gon #Politics https://t.co/eQQT8822Zi\xe2\x80\xa6 https://t.co/1MjQdEkCzd',World,0.0,0.0
2020-05-02 08:35:03,b'Trump bans use of foreign power grid equipment https://t.co/FUUHelMBXl #Politics https://t.co/eQQT8822Zi #Trump\xe2\x80\xa6 https://t.co/COKoh4WdrG',World,-0.125,0.125
2020-05-02 08:35:02,b'India makes government tracing app mandatory for all workers https://t.co/ZMvlARdpiE #Politics\xe2\x80\xa6 https://t.co/WKP6ryzLYs',World,0.0,0.0
2020-05-02 08:31:59,b'As they say 6 years is a long  time in #politics. \nThis is before @shabbysahi returned for her second innings on\xe2\x80\xa6 https://t.co/XaEDOrnuKb',London / Delhi ,-0.025,0.2
2020-05-02 08:30:11,"b'Fool still has job because of his BS capacity.Can fill columns w/poorly researched info,feelgs &amp;political bias fast\xe2\x80\xa6 https://t.co/hYvIyj9tbq'",,0.0,0.0
2020-05-02 08:29:24,b'How His Sexual Assault Denial Interview Could Well Help Biden More Broadly  #Democrats #Election #Opinion #Politics\xe2\x80\xa6 https://t.co/5cKgzXvk6X',San Jose,0.3541666666666667,0.5486111111111112
2020-05-02 08:26:14,b'10. Hope is the backbone of micro #politics\nMicro politician does not think that he cannot change the world alone.\xe2\x80\xa6 https://t.co/1JsWwVeIQp',"Istanbul, Turkey",0.0,0.0
2020-05-02 08:25:27,b'This is why I feel the way I feel. If this kid feels like this it a human right. #humanrights #everychildmatters\xe2\x80\xa6 https://t.co/zLQrvCfdJY',"Tampa, FL",0.14285714285714285,0.31785714285714284
2020-05-02 08:23:21,b'Midnight Hour https://t.co/pRdHFd6wuE follows up where Midnight Hour left off https://t.co/scrue6RLoF. Political le\xe2\x80\xa6 https://t.co/xoKs7IXMpC',,0.0,0.05
2020-05-02 08:21:40,"b'3/ I personally find France a very #stressfull place to be: Too #crowded, too much #noise, too much #pollution, too\xe2\x80\xa6 https://t.co/y5un7DQX1T'",Norway,0.15000000000000002,0.25
2020-05-02 08:20:27,b'Jonathan Turley shreds Biden for not allowing even a search of his Delaware senate records https://t.co/vn0qHeZAkV #politics #therightscoop',DC,0.0,0.0
2020-05-02 08:18:21,"b'What #newnormal after #COVID19? \nWars in Yemen, Iraq, Syria, Sudan, Somalia...\n#povertry and #starvation\xe2\x80\xa6 https://t.co/P0Dy1J4Ue4'",,0.0,0.0
2020-05-02 08:15:08,"b'Omar Khadr event at Dalhousie U: Was this $8,000 payment a speaker\xe2\x80\x99s fee for a convicted terrorist?\xe2\x80\xa6 https://t.co/3V4pOdLFwc'",DC,0.0,0.0
2020-05-02 08:10:02,b'India makes government tracing app mandatory for all workers https://t.co/ZMvlARdpiE #Politics\xe2\x80\xa6 https://t.co/OI2guOUd6M',World,0.0,0.0
2020-05-02 08:09:21,"b'Hey all! Here\'s a post you\'ve missed! Read about why.... ""Low-Income Housing Is Designed To Keep You Poor.""\xe2\x80\xa6 https://t.co/WxoRJRf78m'",United States,-0.4,0.6
2020-05-02 08:08:09,b'A juicy little piece of prose for all those who watch the tragic machinations of our eccentric overlords with eyebr\xe2\x80\xa6 https://t.co/IGhdbRIAJA',United Kingdom,-0.3125,0.5833333333333334
2020-05-02 08:08:03,b'Trump urges Michigan Governor to settle with anti-lockdown protesters #PoliticalParties #Whitehouse #Politics https://t.co/0BwwX24zAx',"Washington, DC",0.0,0.0
2020-05-02 08:06:52,"b'PURCHASE YOURS NOW (Book Review One of ""Freedom and The ...)  - https://t.co/KLTlSC1r9W #BookAboutWillPower\xe2\x80\xa6 https://t.co/WkfcvjtMr1'",Missouri,0.0,0.0
2020-05-02 08:05:23,b'New York City to shut down subways between 1 a.m. and 5 a.m. for cleaning during pandemic https://t.co/Sx8f6WzZI5 #justthenews #politics',DC,-0.009595959595959616,0.3717171717171717
2020-05-02 08:04:34,b'President Trump goes at it with CNN\xe2\x80\x99s Jim Acosta in the Oval Office: Your network \xe2\x80\x98tormented\xe2\x80\x99 Gen. Flynn. I sure ho\xe2\x80\xa6 https://t.co/5RkVr7PCI7',At Your Fingertips,0.5,0.8888888888888888
2020-05-02 08:04:12,b'Even the ignorant will see even if it\xe2\x80\x99s too late that we are all in this world this place this time together as one\xe2\x80\xa6 https://t.co/3shQ3IWpZS',"Los Angeles, CA",-0.3,0.6
2020-05-02 08:03:21,"b'.@Outlookindia announces its brand new show ""Political Pulse"", where the finest minds from Indian #politics will di\xe2\x80\xa6 https://t.co/FJNTVwACgP'","New Delhi, India",0.06818181818181818,0.2772727272727273
2020-05-02 08:00:59,"b'We make a living by what we get, but we make a life by what we give \xe2\x9c\xa8\n\nhttps://t.co/iayIWYIeYa\n\n#zarakhan\xe2\x80\xa6 https://t.co/MXXUS3PLEn'",,0.0,0.0
2020-05-02 08:00:56,b'You are known by the earth your hands make a difference your heart builds hope in a world tossed and torn. #Politics #Love',"Los Angeles, CA",0.5,0.6
2020-05-02 08:00:53,b'Nigeria amidst other African countries to receive $3M Covid_19 response grant from afreximbank.\n\n#news #politics #covid19 #streetmedia',Lagos. New York,-0.0625,0.1875
2020-05-02 07:59:34,b'Tom Hanks sends heartfelt letter to 8-year-old who was bullied for having the name Corona https://t.co/S3r6bPlMi0 \n   \n#Politics',At Your Fingertips,0.0,1.0
2020-05-02 07:58:42,b'Each one of us represents a thread in the fabric of life some rich some poor some brilliant some dull some tight so\xe2\x80\xa6 https://t.co/OyaX8PKi7O',"Los Angeles, CA",0.08095238095238093,0.6271428571428571
2020-05-02 07:56:13,b'@CAgovernor Good \xf0\x9f\x91\x8f\xf0\x9f\x8f\xbc\xf0\x9f\x91\x8f\xf0\x9f\x8f\xbc\xf0\x9f\x91\x8f\xf0\x9f\x8f\xbc  because I dislike #politics \xf0\x9f\x98\x9c #Thanks #Governor @GavinNewsom You are doing a fine \xf0\x9f\x91\x8c\xf0\x9f\x8f\xbc job l\xe2\x80\xa6 https://t.co/mDkBTxlN9u',,0.4388888888888889,0.43333333333333335
2020-05-02 07:53:40,"b'Same paddlers.\n\nSame self interest.\n\nSame kowtowing.\n\nThe world over.\n\nUgh, we need a clean out of the political cl\xe2\x80\xa6 https://t.co/JHsLiigDbu'","Perth, Australia",0.07333333333333333,0.23500000000000004
2020-05-02 07:53:27,"b'So much to unpack here! \nYoung men feel the most qualified for #politics, but are the less likely to take #civic ac\xe2\x80\xa6 https://t.co/k2WbAGDWTq'","Brussels, Belgium",0.13666666666666666,0.4333333333333334
2020-05-02 07:53:03,"b'#Virus ""Basta la Revolucion""\n\n#Sanders, #Warren, and others wanted to remake American politics, but the #pandemic r\xe2\x80\xa6 https://t.co/B7FX1MNJhW'",Paris - Lyon - NYC - Tel Aviv,0.0,0.0
2020-05-02 07:52:57,b'Hey let\xe2\x80\x99s talk about some politics #Politics #2020election',,0.0,0.0
2020-05-02 07:51:28,b'Wow  i still see fan hoping the days where @Suriya_offl and @actorvijay will come together for #Politics in\xe2\x80\xa6 https://t.co/TagGEJylmC',Singapore,0.1,1.0
2020-05-02 07:50:00,b'9 - 10am // Culture channel: @RemainiacsCast.\n\nListen live via https://t.co/m3xENCAUa8 \n\n#politics',"Soho, London",0.13636363636363635,0.5
2020-05-02 07:48:16,b'Wheels falling off the #solar market and what a mess they leave strewn across the land.\n\n#CleanUpAustralia #auspol\xe2\x80\xa6 https://t.co/rPB3GxD2Yi',The land of Oz,-0.175,0.175
2020-05-02 07:46:07,"b'""Bacon argued that there are four causes of error: 1) weak and unworthy authority, 2) longstanding customs, 3) the\xe2\x80\xa6 https://t.co/8edTGdXVCx'","Canberra, Australia",-0.375,0.625
2020-05-02 07:44:47,"b'My heart goes out to the lives lost and the mourning families. However, stricter gun laws are not the answer when t\xe2\x80\xa6 https://t.co/1bYo2FSl7K'","Medicine Hat, Alberta",0.0,0.0
2020-05-02 07:44:34,b'Watch: Quarantined stuntmen (and women) show off their moves in epic viral \xe2\x80\x98fight\xe2\x80\x99 https://t.co/chv6dlwOLj \n   \n#Politics',At Your Fingertips,0.1,0.4
2020-05-02 07:44:32,"b'Just wondering, but when do we get to say Fuck it! Enough is enough! #politics #covid #elections #Democrats\xe2\x80\xa6 https://t.co/TU0vcKsXTS'","El Monte, California",-0.16666666666666666,0.5333333333333333
2020-05-02 07:44:00,b'\xe2\x80\x9cNothing is more beautiful than the loveliness of the woods before sunrise.\xe2\x80\x9d - George Washington Carver\n#society\xe2\x80\xa6 https://t.co/QdalvFqPsb',,0.675,0.75
2020-05-02 07:43:00,b'White House Blocks Fauci\xe2\x80\x99s Congressional Testimony. https://t.co/5VInGIdmi7 #US #Coronavirus #Covid19 #politics',"Barcelona, Catalonia",0.0,0.0
2020-05-02 07:41:56,"b'Amritsar International Airport: Qatar Airways operated two flights today morning, to ...\xe2\x80\xa6 https://t.co/cJX7igQNCL'",Chandigarh,0.0,0.0
2020-05-02 07:40:06,"b'Humans are weird. Building houses too close to trees, then demand trees to be cut. \xf0\x9f\xa4\x94\nHelp stop it at least in Portl\xe2\x80\xa6 https://t.co/qfirxpe9Jc'","Lübeck, Germany",-0.4,0.7
2020-05-02 07:38:15,b'Seattle\xe2\x80\x99s Leaders Let Scientists Take the Lead. New York\xe2\x80\x99s Did Not | The New Yorker #COVID19 #coronavirusus #NYC\xe2\x80\xa6 https://t.co/51eSaoZekE',San Francisco,0.13636363636363635,0.45454545454545453
2020-05-02 07:37:59,"b'Hey all! Here\'s a post you might have missed. Read about....""The Spreading Infodemic Of Misinformation.""\xe2\x80\xa6 https://t.co/HL1MNBcfUo'",United States,0.0,0.0
2020-05-02 07:33:54,"b'@George_Osborne @MattHancock Sorry George, but there are many UK citizens who are not interested. All we want is th\xe2\x80\xa6 https://t.co/WO9KoY7hew'","Paignton, Devon",-0.041666666666666664,0.6666666666666666
2020-05-02 07:30:08,b'NBC News gets TORCHED after tweeting fake news to make Trump look bad\xe2\x80\xa6 https://t.co/BISgprKmio #politics #therightscoop',DC,-0.5,1.0
2020-05-02 07:25:34,b'Why does PPP deny of any assistance from center?\n#PPP #PTIGovernment #GVSNews #Pakistan #Politics @PTIofficial\xe2\x80\xa6 https://t.co/wOwdB5g7Yq',,-0.1,0.1
2020-05-02 07:25:29,"b'Are stay at home orders #oppression?\nA) No\nB) No, but this could be misused later to oppress, we are setting a dang\xe2\x80\xa6 https://t.co/BI3WJEHk1h'","Tucson, AZ",0.0,0.0
2020-05-02 07:18:49,b'Trump supporter protesting against stay at home order\n\n#covid_19 #coronavirus #trump #trump2020 #borderwall\xe2\x80\xa6 https://t.co/4GrIwb1ujp',Istanbul Turkey,0.0,0.0
2020-05-02 07:16:48,b'First amendment right of free speech violation by #VP #Pencehttps://www.bestmagyou.com/2020/05/01/pence-steve-herma\xe2\x80\xa6 https://t.co/Re2kaNHQGJ',,0.3119047619047619,0.5563492063492064
2020-05-02 07:15:08,b'To vote means that voters have to chose out of competing options. Hence why an election campaign is all about defin\xe2\x80\xa6 https://t.co/gjNlutPhFm',"Zurich, Switzerland",0.0,0.0
2020-05-02 07:13:30,b'RT&gt;&gt;&gt;#Like #SubscribeNow @kenbucktweets\xe2\x80\x99 Congressman Ken Buck\xe2\x80\x99s \n\n         DRAIN THE SWAMP \n\n#USA #Politics\xe2\x80\xa6 https://t.co/Yeg8be7Otc',"Hollywood, FL",0.0,0.0
2020-05-02 07:12:04,b'Triggered! \n#starwarsmandalorian #joebiden #dank #babyyodameme #trump #creepyjoebiden #berniesanders #politics\xe2\x80\xa6 https://t.co/SNy0U7siEh',"Nevada, USA",0.0,0.0
2020-05-02 07:07:04,b'@lordcudjoe Aaha! This one too? Even SRC presidents does it better in Q&amp;A sessions how much more a trained communic\xe2\x80\xa6 https://t.co/hYfOpo6V9t',"Central, Ghana",0.5,0.5
2020-05-02 07:05:53,"b""Compare the news side-by-side to see who's telling the whole story. Comment on bias or under-reporting. Share to su\xe2\x80\xa6 https://t.co/FLbYxTbgGo""",,0.2,0.4
2020-05-02 07:04:37,b'COMMISSIONERATE POLICE BOOKS A YOUNGSTER AND HIS FATHER FOR RUNNING OVER ... #AssistantSubInspectorOfPolic\xe2\x80\xa6 https://t.co/tmIeKtVPky',Chandigarh,0.0,0.0
2020-05-02 07:04:23,"b""'Who represents the poor?'- Firdous Ahmad Malik &amp; Maajid Hussain Bhat \n#poverty #Politics #India\xe2\x80\xa6 https://t.co/dHAYY2Fkn3""",,-0.4,0.6
2020-05-02 07:02:57,b'Follow the lockdown with patience: Yogi - https://t.co/IgaiRL9qpe \nGet your news featured use #IndiaPostUSA\xe2\x80\xa6 https://t.co/lPnZHrnc43',"Fremont, CA, USA",0.0,0.0
2020-05-02 07:02:03,b'@Dev_Fadnavis Provided we re-set the urban planning button. Urban planning has been marred 4 decades by #Politics &amp;\xe2\x80\xa6 https://t.co/C75QzBOYZf',Mumbai - Maharashtra - India,0.0,0.0
2020-05-02 07:01:36,b'Who is White? Who is European? https://t.co/bPNTzaYZZT #sociology #merkel #qanon #nationalism #germany #italy\xe2\x80\xa6 https://t.co/00z1aSJDOk',,0.0,0.0
2020-05-02 07:01:24,b'@charliekirk11 What did Trump go through for his nomination and presidency? There were many many women who made all\xe2\x80\xa6 https://t.co/f9Pmm7kUMS',,0.5,0.5
2020-05-02 06:59:15,"b""@Justme67623090 @Garthawk @DeAnna4Congress @w_terrence Pelosi's won by 80%+ of the vote, every two years since 1989\xe2\x80\xa6 https://t.co/u77LGKg2Zc""","Michigan, USA",0.0,0.0
2020-05-02 06:57:28,b'The Border Wall &amp; #America. Are We a Homeless Person or A Homeowner? https://t.co/Q19f5i56da #BorderWall\xe2\x80\xa6 https://t.co/8Irfmf6FZg',"Missouri, USA",0.0,0.0
2020-05-02 06:57:20,b'Lee Smith: Washington Post\xe2\x80\x99s Russiagate Conspiracists Now Lying About Trump\xe2\x80\x99s Handling of Coronavirus https://t.co/5xKbtXNbDE #politics',"Los Angeles, CA",0.0,0.0
2020-05-02 06:54:51,b'.@HillaryClinton supports @ChristyforCA25 \n\nAwesome!\n\n#CA25 \n#Politics https://t.co/WKGrwwPJ81',Twitter ,1.0,1.0
2020-05-02 06:52:15,b'Donald Trump team blocks Anthony Fauci from testifying before congressional committee #politics #news #analysis https://t.co/e1p0IoSzHu',,0.0,0.0
2020-05-02 06:52:15,"b""Obama team fully vetted Biden in 2008 and found no hint of former aide's allegation #politics #news #analysis https://t.co/HmFBWORpGV""",,0.0,0.0
2020-05-02 06:50:31,b'There is a virus called #Politics which have NO CURE for entire lifetime.\nWaste of resources do not count in this\xe2\x80\xa6 https://t.co/GEtY6zWCon',"गुवाहाटी, भारत",-0.1,0.3125
2020-05-02 06:50:15,b'Pick of the Day\nhttps://t.co/W8Wkjq1g0z \n#UddhavThackeray #electioncommission #Maharashtra #NarendraModi\xe2\x80\xa6 https://t.co/nuZEdEYeir',,0.0,0.0
2020-05-02 06:48:50,"b'@dhume In western media everyone is asking to listen to experts, be it pandemic or economic.. But here in India we\xe2\x80\xa6 https://t.co/j3jlq3SMaD'",,0.1,0.1
2020-05-02 06:47:27,b'Temperature checks among measures considered as part of lockdown easing plans: People could\xe2\x80\xa6 https://t.co/XW9rZkUXw3 #SKY #News #Politics',United Kingdom,0.0,0.0
2020-05-02 06:45:11,b'Flights From China Dropped 86 Percent After Trump\xe2\x80\x99s Travel Ban: CDC https://t.co/TXF7GWP5bP #politics #theepochtimespolitics',DC,0.0,0.0
2020-05-02 06:44:39,"b'Yet another, very sad political game, played with a backdrop of thousands of people dying. Please, can we just get\xe2\x80\xa6 https://t.co/HUk75ASRii'","Paignton, Devon",-0.35000000000000003,0.5
2020-05-02 06:42:02,"b'https://t.co/fwaWw4ZjSZ\n\n#TrumpPressConference ""PANTS ON FIRE LIE, he\'s more obsolete than the Test kits he\'s refer\xe2\x80\xa6 https://t.co/rHPbiWOgxR'","Liloan, Cebu, Philippines",0.5,0.5
2020-05-02 06:40:10,"b'Fuck 5 hour energy, all my homies do 55 hour energy #drugs #Politics https://t.co/6rXBEoDuxb'","South Carolina, USA",-0.4,0.6
2020-05-02 06:37:32,b'Rabid.. gone but not forgotten. https://t.co/i06JDvP2bC #politics #satire #Poverty #Pips #ESA #WCA #NHS #UniversalCredit 1',The seventh house ,0.0,0.0
2020-05-02 06:35:44,b'@AQUIBMIR7 Separatists people and #Politics of #kashmiri',BHARAT,0.0,0.0
2020-05-02 06:35:32,b'WATCH LIVE: President Trump holds daily coronavirus task force in the Rose Garden at 5:30PM https://t.co/JzrAzbglRG #politics #therightscoop',DC,0.24545454545454545,0.48333333333333334
2020-05-02 06:32:12,b'#Chandigarh: 6 More test positive; total cases 94 in #City #6MoreTestPositive #totalCases94 #BreakingNews\xe2\x80\xa6 https://t.co/1ugPO4MXiG',Chandigarh,0.24242424242424243,0.5984848484848485
2020-05-02 06:29:02,b'Every Woman Is Born With This Talent Of Looking At Phone Of Partner\n\nAway from #Politics and #Covid19 matter\n\nEvery\xe2\x80\xa6 https://t.co/kaXrSs1Vrz',Nigeria,0.0,0.0
2020-05-02 06:28:02,"b'#Politics, not economics was pursued by the past several Indian high commissioners in #London with varying success.\xe2\x80\xa6 https://t.co/wVIstKSIUa'","New Delhi, India",-0.03,0.2633333333333333
2020-05-02 06:25:36,b'10 Finest #Politics #Dissertation Topics for College Students\nhttps://t.co/OVDUDkSKp9 https://t.co/u3o1rRQ8we',"London, England",0.0,0.0
2020-05-02 06:25:21,b'#Mohali: 2 more test positive; total cases 94 in district #totalCases94 #2MoreTestPositive #BreakingNews\xe2\x80\xa6 https://t.co/7WN2nXgxGk',Chandigarh,0.24242424242424243,0.5984848484848485
2020-05-02 06:21:04,b'Bombshell: Christopher Steele Just Exposed Hillary and Susan Rice Corrupt dealings During Testimony in British Cour\xe2\x80\xa6 https://t.co/7Ocr1oBc7y',London,-0.25,0.5
2020-05-02 06:20:32,b'Politico Silently Edits False Story on Trump Being Indebted to Chinese Bank \xe2\x80\x93 And It\xe2\x80\x99s Still Wrong\xe2\x80\xa6 https://t.co/CXN42VrQTt',DC,-0.13333333333333336,0.2333333333333333
2020-05-02 06:18:53,"b'Will Next #Coronavirus #Relief Finally #BailOutPeople? @SenWarren &amp; @RepRoKhanna intro #EWBOR, a set of policies 2\xe2\x80\xa6 https://t.co/iuGG8OxZhi'",USA,0.0,0.5
2020-05-02 06:18:07,"b'Nice to see my sister (@MsJenko) on @podbible this week \xf0\x9f\x8e\xa7\n\nGreat list of podcasts created, hosted, and led by\xe2\x80\xa6 https://t.co/WhHthbnhJN'","Birmingham, UK",0.7,0.875
2020-05-02 06:18:06,b'Extension of curfew in #Punjab \xe2\x80\x93 self-explanatory. #EXTENSIONOFCURFEW #ExtensionOfCurfewInPunjab #Selfexplanatory\xe2\x80\xa6 https://t.co/I9JaRg0I7o',Chandigarh,0.0,0.0
2020-05-02 06:17:42,"b'Idea: People Before Profits\nhttps://t.co/fAM9Jukn4q\n#ideamill #idea #capitalism,#communism,#eco,#economy,Ideas,#law\xe2\x80\xa6 https://t.co/NwnwpmlKYV'",,0.0,0.0
2020-05-02 06:16:49,"b""Kisses .. and smiles ... during Nepal 's ugly politics pandemic.  \n~\n#Nepal #coronavirus #uglypolitics #kathmandu\xe2\x80\xa6 https://t.co/SvCcSqBkgO""",Nepal,-0.7,1.0
2020-05-02 06:16:20,"b""#NorthKorea's #Kim reappears after weeks of #speculation\n#politics #Pyongyang #security  https://t.co/PXHoCgXqts""",Al Hilal - C Ring Road,0.0,0.0
2020-05-02 06:15:48,b'Things I love #God #Family #Steelers #twittervskpop #anime #USA #KPOP #SteelersNation #FF #Writing #books #politics\xe2\x80\xa6 https://t.co/R2BxQY4uPa',,0.5,0.6
2020-05-02 06:15:07,b'Press Secretary Kayleigh McEnany Hosts First WH Press Briefing: \xe2\x80\x98I Will Never Lie to You\xe2\x80\x99 https://t.co/hq0dNIiEOP #breitbart #politics',DC,0.25,0.3333333333333333
2020-05-02 06:14:57,"b""This guy whoever he is doesn't seem to be part of the 80% of Canadians. Also I think he just might be a bit of a li\xe2\x80\xa6 https://t.co/yuQRFD59yM""","Spuzzum, British Columbia",0.0,0.0
2020-05-02 06:13:34,"b""Militia group protest in Michigan. I can't help but wonder how this would've turned out if it African Americans beh\xe2\x80\xa6 https://t.co/bm6wYy63Yb""",,0.0,0.0
2020-05-02 06:13:08,b'UK HAS ISSUED ORDER TO COMMENCE FORMAL NEGOTIATION WITH U.S. DESPITE CORONAVIRUS PANDEMIC STILL RAGING IN BOTH COUN\xe2\x80\xa6 https://t.co/Lh1XoRHSqp',"Manhattan, NY",0.0,0.0
2020-05-02 06:12:44,"b""#Coronavirus: governments knew a pandemic was a threat\xc2\xa0\xe2\x80\x93 here's why they weren't better prepared\xe2\x80\xa6 https://t.co/s4yso2QHkp""","Milan, Italy",0.5,0.5
2020-05-02 06:12:38,"b'DOW JONES UNOFFICIALLY CLOSES DOWN 649.29 POINTS, OR 2.67 PERCENT, AT 23,696.43\n\nS&amp;P 500 UNOFFICIALLY CLOSES DOWN 8\xe2\x80\xa6 https://t.co/2uLIwamKZR'","Manhattan, NY",-0.15555555555555559,0.2888888888888889
2020-05-02 06:11:06,"b'Hey all! Here\'s a post you might have missed! Read about....""The Truth Only Matters If You Hear It?""\xe2\x80\xa6 https://t.co/DSTSXGeT9H'",United States,0.0,1.0
