2020-07-05 10:29:28,"b'""Both the climate emergency and this health crisis can be traced to European merchants first landing \non the shores\xe2\x80\xa6 https://t.co/DLY4kDFDp9'",London,0.125,0.16666666666666666
2020-07-05 10:26:22,b'This article makes some interesting observations - \n\nU.N. Warns of Devastating Environmental Side Effects of Electr\xe2\x80\xa6 https://t.co/FNttiYVDAN',"England, United Kingdom",-0.25,0.75
2020-07-05 10:08:19,"b""XR 'twin' Jenrick's Eye Manor mansion in Herefordshire with Tower Hamlets @RobertJenrick @XRTowerHamlets @XRMarches\xe2\x80\xa6 https://t.co/KI1aU9NRtp""",,0.0,0.0
2020-07-05 09:57:37,b'hydro dam reservoirs because there are more than 57000 large dams worldwide. 4 May 2020 #BuildBackBetter\xe2\x80\xa6 https://t.co/Je46E33emJ',,0.35714285714285715,0.4642857142857143
2020-07-05 09:36:47,b'\xe2\x82\xac.#GreenNewDeal AINT ABOUT #ClimateJustice IT IS ABOUT.   \xe2\x80\x9ccontrol \xe2\x80\x9c #DEGROWTH \n@GOPLeader @GOPoversight\xe2\x80\xa6 https://t.co/10HpyumDvE',PARLER-Gulag_as_Weapon @jgm456,0.0,0.0
2020-07-05 09:35:55,b'Let the rain wash away all the pains of yesterday. I find peace in #rains. #Konkan &amp; #Mumbai experiencing intense s\xe2\x80\xa6 https://t.co/P7apP2DbjY',,0.2,1.0
2020-07-05 09:08:52,"b'Renewables are cheap and effective. Now, let\xe2\x80\x99s make them just and humane too... \xe2\x80\x9cby healing grassroots democracy, r\xe2\x80\xa6 https://t.co/KS2BjiVzbF'","London, England",0.5,0.75
2020-07-05 08:52:05,b'Day 66: #SaveCongoRainforest #SaveCongoForest_Flora_Fauna azarath metrion zinthos \xf0\x9f\x92\x9a @vanessa_vash @Remy_Zahiga\xe2\x80\xa6 https://t.co/3a3VmqkoCV',"Belfast, Northern Ireland",0.0,0.0
2020-07-05 08:45:21,b'Listen to Extinction Rebellion activist Anne Younger explain why she sat down in the road to protect the planet.\xe2\x80\xa6 https://t.co/3gsGI0hshv',"Shoreham-by-Sea, England",-0.07777777777777779,0.14444444444444446
2020-07-05 07:41:24,"b'@RBReich The USA is not sustainable, and for the good of our planet, needs to be disbanded.\n#ClimateEmergency\xe2\x80\xa6 https://t.co/d7oYisC7cM'",Korrekt side av Mjøsa,0.7,0.6000000000000001
2020-07-05 07:36:01,b'Stand together on the 1st of September for #ClimateJustice https://t.co/QghfomkkQq',"Shoreham-by-Sea, England",0.0,0.0
2020-07-05 07:15:30,b'@Greenpeace It is not too late either for #Greenpeace in alliance w #XR to build the global movement necessary to d\xe2\x80\xa6 https://t.co/OxRdRWlTv4',,-0.09999999999999999,0.5333333333333333
2020-07-05 07:07:21,"b""Greenpeace: Using the courts to protect what's most precious. \n\n#ClimateJustice\n\nhttps://t.co/p8V9fGgKeA""",,0.5,0.75
2020-07-05 07:02:12,"b'New Tumblr post: """"Favorite tweets: Great! #ClimateJustice also on TikTok ;)https://t.co/ofauyrlbgG\xe2\x80\x94 Parents For Fu\xe2\x80\xa6 https://t.co/slIZs8IF16'",Holzminden,0.47159090909090906,0.8011363636363636
2020-07-05 06:45:21,"b'I am hosting COVID 19 AND CITIES. HUMAN RIGHTS, ENVIRONMENT AND GOVERNANCE. Would you like to attend?\xe2\x80\xa6 https://t.co/e9VbWZzmPc'",Italia,0.0,0.1
2020-07-05 06:44:13,b'Faith leaders call for environment-focused economic recovery https://t.co/fpr3M2Pvk4 via @ekklesia_co_uk\n#BuildBackBetter #ClimateJustice',,0.2,0.2
2020-07-05 05:53:49,"b'Hope, resilience and the fight for a sustainable future - Mary Robinson \n#ClimateJustice https://t.co/HupC6IbLln'",,0.0,0.125
2020-07-05 05:37:24,b'July was confirmed as the hottest month on record. Global Warming has been mostly our choice but we can make up for\xe2\x80\xa6 https://t.co/nWRSb8Lqad',"Kampala, Uganda",0.3,0.5
2020-07-05 04:56:59,b'Environmental Movement Takes A Big Leap In Germany https://t.co/9FYg3Qy5L3 #environment #natural #recycling\xe2\x80\xa6 https://t.co/RQiY3nHh0z',,0.05,0.25
2020-07-05 03:30:06,b'\xf0\x9f\x8c\xb1Make sure to tag our Instagram handle (@green_brigade_cvs) and nominate three other persons to do the same. \n\xf0\x9f\x8c\xb1The\xe2\x80\xa6 https://t.co/mQfmnpckFt',College Of Vocational Studies,0.125,0.46296296296296297
2020-07-05 03:06:25,"b'Good morning.\nHappy #Sunday to all those fighting for Social, Economic &amp; #ClimateJustice.\n\n#ClimateCrisis\xe2\x80\xa6 https://t.co/1VZb9x25QU'",,0.43333333333333335,0.4666666666666667
2020-07-05 02:33:51,"b'@luisbaram $10,000+ per person!\n\nWhen do I get my check?\n\n#ClimateJustice for \xf0\x9f\x87\xa8\xf0\x9f\x87\xa6'",,0.0,0.0
2020-07-05 01:13:55,b'A beginners guide to understanding the concept of Intersectional Environmentalism and how to incorporate it into yo\xe2\x80\xa6 https://t.co/jkcgrT6sTY',,0.0,0.0
2020-07-05 00:48:28,b'Climate change and carceral settler-colonialism on a collision course with Covid-19 this year.\n\n#ClimateEmergency\xe2\x80\xa6 https://t.co/ytY6HQ94Aj',here & there on Treaty 1 land,0.0,0.0
2020-07-05 00:40:37,b'So great to see the youth taking action! #ClimateAction #climatejustice #climatecrisis #ClimateStrikeOnline https://t.co/bvqFkspAPu',,0.4625,0.425
2020-07-05 00:34:31,b'Check out our new Independence Day blog at https://t.co/8QzA9sRvC0 \n\n#blacklivesmatter #racialjustice\xe2\x80\xa6 https://t.co/xNf03uG4mw',,0.13636363636363635,0.45454545454545453
2020-07-05 00:21:34,"b'It is NOT a better way, it\xe2\x80\x99s a faster way. \n\nThe better way would be not relying on harmful resources like oil. May\xe2\x80\xa6 https://t.co/7D6HmlVHWv'","Toronto, Ontario",0.125,0.5
