2020-04-29 23:59:21,"b'""Joe Biden says he\'d leave US embassy in Jerusalem if elected"" Covered by 7 sources incl @WashTimes (Right) @AP (Ce\xe2\x80\xa6 https://t.co/QSlh3F5KE4'",,0.2857142857142857,0.5357142857142857
2020-04-29 23:59:10,b'Democratic Frustration Mounts as Biden Remains Silent on Sexual Assault Allegation #democrat #Biden2020 #politics\xe2\x80\xa6 https://t.co/1rqsMnmkSP',,0.25,0.4666666666666667
2020-04-29 23:58:43,b'@ScottGarnham @holmesjsamuel More I see him the more I think what a tw@t Corbin was - this guy is statesman like\xe2\x80\xa6 https://t.co/IaPRfyGx4k',,0.5,0.5
2020-04-29 23:58:37,b'New Evidence of Mueller Blackmail Using Threat Against Flynn Jr\xe2\x80\xa6 https://t.co/zW6AQPj4bJ #TRoom #politics',United States,0.13636363636363635,0.45454545454545453
2020-04-29 23:57:30,"b'Hey all! Here\'s a post you might have missed! Read about...""Mental Health and Homelessness""\xe2\x80\xa6 https://t.co/j2R5tvZ8eO'",United States,-0.1,0.2
2020-04-29 23:56:37,"b""Don't Give Up \nPOWERFUL \xf0\x9f\x92\xaa\xf0\x9f\x8f\xbe\n.\n.\n#AyobamiBlog #news #update #event #gist #politics #education #promotionservices\xe2\x80\xa6 https://t.co/zHUTwdegLh""","Lagos, Nigeria",0.3,1.0
2020-04-29 23:56:07,b'FLASHBACK: Covington and Burling \xe2\x80\x93 The Secret Conspiracy Undermining Michael Flynn.. https://t.co/2YyQsw71vl #TRoom #politics',United States,-0.4,0.7
2020-04-29 23:55:08,b'Why Joe Biden Can\xe2\x80\x99t Survive His Sexual Assault Allegations Like Brett Kavanaugh Did https://t.co/F6ym8QxbP8\xe2\x80\xa6 https://t.co/NW2Fd2YM3r',United States,0.5,0.8333333333333334
2020-04-29 23:52:35,b'Grassley Demands DOJ Release All Exculpatory Information on Michael Flynn\xe2\x80\xa6 https://t.co/Fv1x6nQIxP #TRoom #politics',United States,0.0,0.0
2020-04-29 23:52:11,b'Hispanics Don\xe2\x80\x99t Have to Be Leftists  #BretScher #CandaceOwensShow #DennisPrager #FireSideChat #prageru #WillWitt\xe2\x80\xa6 https://t.co/qkS7JZQqat',"Glens Falls, NY",0.0,0.0
2020-04-29 23:51:30,b'Explosive Revelations in the Flynn Case\xe2\x80\xa6 https://t.co/H6zxsb1zwl #TRoom #politics',United States,0.0,0.0
2020-04-29 23:49:44,b'It\xe2\x80\x99s Time to Build a Better Political Culture  https://t.co/VRGMwBfaBX @pmarca @ezraklein @newrepublic #politics',"Cleveland, OH",0.25,0.3
2020-04-29 23:49:04,b'#revolutionseries #politics Power through knowledge site:All ask for IT Is freedom really that #good for homosapiens https://t.co/OqT3ZLFvqR',UK,0.44999999999999996,0.4
2020-04-29 23:48:13,b'So have we abandoned destroying the debt? Being that I\xe2\x80\x99ll be apart of the generation that has to make the decision\xe2\x80\xa6 https://t.co/qpw936rTsH',"Weirton, WV",-0.2,0.0
2020-04-29 23:47:06,"b""Exclusive \xe2\x80\x94 Juanita Broaddrick Blasts Hillary's Biden Endorsement: Has 'Decades of Experience' Enabling 'Sexual Pre\xe2\x80\xa6 https://t.co/McD9ouBZGB""",United States,0.5,0.8333333333333334
2020-04-29 23:46:29,b'Poverty Solutions\n\n#medium #Homeless #Poverty #Charity #Housing #news #politics #government #tcot #MAGA #GOP #RNC\xe2\x80\xa6 https://t.co/bc2MaIJd5J',,0.0,0.0
2020-04-29 23:44:20,"b""Putin's pride: Cossacks and the church | DW Documentary https://t.co/Rzru7Gp1rD #politics #religion""","Wide Bay, Australia",0.0,0.0
2020-04-29 23:43:03,b'#World #Politics #Agendas #Elections #Dictators #Socialism #Viruses #Economies #AttentionSeekingCelebrities #Idiots\xe2\x80\xa6 https://t.co/IexFN8lfHj',Finding A Middle Ground Planet,0.0,0.0
2020-04-29 23:43:00,b'Which Hip Hop star is a lock for the White House?: Blaq Whole [dat calm] https://t.co/FXQwnVS0D2 #pandemic\xe2\x80\xa6 https://t.co/gNUN0dm9MY',United States,0.16666666666666666,0.3833333333333333
2020-04-29 23:41:54,"b""Ben Shapiro is an idiot. Not because he's a conservative, but because he's an insensitive (yet highly thin-skinned)\xe2\x80\xa6 https://t.co/3QljiEUW42""","Toronto, Ontario",-0.32,0.6699999999999999
2020-04-29 23:41:22,b'I just published The Year of Governors? 50-Way Race Has U.S. Learning Our States https://t.co/RSSeRD5zge #states\xe2\x80\xa6 https://t.co/N1jCcKvcfK',#PureMichigan,0.0,0.0
2020-04-29 23:40:25,"b'FLASHBACK: Horowitz Report Spotlights Little-Known FBI Agent\xe2\x80\x99s Role in Flynn Case, Russia Probe\xe2\x80\xa6 https://t.co/RQPietXKvu #TRoom #politics'",United States,0.0,0.0
2020-04-29 23:40:13,b'#Political prosecution? Dirty #FBI agents? Set-ups? #Surveillance? #Injustice? Nothing in our history shows that ou\xe2\x80\xa6 https://t.co/0Bf2ToJTVU',"Scottsdale, AZ",-0.3,0.45
2020-04-29 23:39:43,b'Donald Trump To Do Fox News Virtual Town Hall On Sunday At Lincoln Memorial - Deadline #Government #Whitehouse\xe2\x80\xa6 https://t.co/khLURuShrE',"Washington, DC",0.0,0.0
2020-04-29 23:39:43,"b""Trump: Current federal guidelines will be 'fading out' - CNN #Politics #Whitehouse #Political https://t.co/SILXWcs6tt""","Washington, DC",0.0,0.25
2020-04-29 23:39:41,b'The #Patriots end game \xf0\x9f\x87\xba\xf0\x9f\x87\xb8\xe2\x9c\x8a\xf0\x9f\x87\xba\xf0\x9f\x87\xb8\nhttps://t.co/nl2xhSuUra\n\n#Trump #congress #politics #news #CoronavirusUSA\xe2\x80\xa6 https://t.co/CJlrI5vnwT',"Florida, USA",-0.4,0.4
2020-04-29 23:37:43,"b""@the_ac_stories It's 2021.  Trump has been re-elected and the students of Upstate College are about to have a meltd\xe2\x80\xa6 https://t.co/6PvGJDJeHp""",Upstate College,0.0,0.0
2020-04-29 23:35:40,"b'""Threats to freedom of speech, writing and action, though often trivial in isolation, are cumulative in their effec\xe2\x80\xa6 https://t.co/J5dYa2APL2'","Toronto, Ontario",0.1,0.1
2020-04-29 23:35:14,"b'On noise and politics, and political noise. #noise #Politics https://t.co/SgwAEFqHln'",,0.0,0.1
2020-04-29 23:35:08,"b""@CharriseLane That's liberals and their antifa babies for you. So much tolerance for different lifestyles and persp\xe2\x80\xa6 https://t.co/QHd8tEAwFK""","Westwood, NJ",0.1,0.4
2020-04-29 23:34:31,b'Flashback: FBI Agent Used \xe2\x80\x98Briefing\xe2\x80\x99 with Trump to Spy on Mike Flynn\xe2\x80\xa6 https://t.co/ExlMk74JPQ #TRoom #politics',United States,0.0,0.0
2020-04-29 23:30:33,"b""#IlhanOmar's attack on #ElonMusk seems to have backfired. #Coronavirus #ElonMusk #IlhanOmar #JustIn #politics\xe2\x80\xa6 https://t.co/cNm5GG9M2a""","Phoenix, AZ",0.0,0.0
2020-04-29 23:30:03,b'FBI ON FLYNN SET-UP: \xe2\x80\x9cWHAT IS OUR GOAL? TRUTH/ADMISSION OR TO GET HIM TO LIE SO WE CAN PROSECUTE HIM OR GET HIM FIR\xe2\x80\xa6 https://t.co/ePsRD4tL9u',United States,0.0,0.0
2020-04-29 23:29:53,"b'Fans fighting over which of their political parties are worse- Republicans or Democrats, is the same as #Lions and\xe2\x80\xa6 https://t.co/66RWpiXJ6C'",,-0.13333333333333333,0.27499999999999997
2020-04-29 23:28:59,"b""@SenGillibrand why are you silent now? Oh wait, the only reason you spoke out was because you didn't want Kavanaugh\xe2\x80\xa6 https://t.co/73b5oUFu6y""",United States,0.0,0.55
2020-04-29 23:28:46,"b""Hell isn't a real place, but if it were, it would be the fear reflected in the eyes of Trump's barber. \n\n#poem #amwriting #politics""",,0.2,0.30000000000000004
2020-04-29 23:28:24,b'https://t.co/9vhwmMue8k\n\n#UttarPradesh #Administration #Politics #SadhuKeHatyarokoBiryani #SadhuLynching #Sadhus\xe2\x80\xa6 https://t.co/HQNLjAxm5B',🇮🇳INDIA,0.0,0.0
2020-04-29 23:27:19,b'Reason:  Kentucky Attorney General vs. Kentucky Governor (and Kentucky District Court) in Church Shutdown Litigatio\xe2\x80\xa6 https://t.co/GPVykB40vb',Maryland,0.05000000000000002,0.5
2020-04-29 23:26:15,"b'Watching Inception as Inception incepts me as I watch it, thinking about further inceptions to perform tomorrow.\xe2\x80\xa6 https://t.co/3hchPFVoDN'","Cleveland, OH",0.0,0.5
2020-04-29 23:24:31,b'That\xe2\x80\x99s what happens #Politics https://t.co/h9Td0Qb0hX',"Tulsa, OK",0.0,0.0
2020-04-29 23:23:46,b'HUGE! #SnipYourStrings and #WakeUpAmerica #workingfromhome #lovelive #COVID19 #Truth #Politics #healthy #media\xe2\x80\xa6 https://t.co/dFgXkl5jqK',"Westwood, NJ",0.5,0.7
2020-04-29 23:21:27,b'@WhiteHouse #American #politics is so #corrupt ! \nEspecially the @GOP \nhttps://t.co/KFbWZI8D5l',,-0.20833333333333334,0.6666666666666666
2020-04-29 23:21:14,"b""Don't let this crisis convince you that Telemedicine can replace conventional care. IT CAN'T! The push to do that i\xe2\x80\xa6 https://t.co/YhAJUWxSWP""",The Haunted American Southwest,-0.17857142857142855,0.35714285714285715
2020-04-29 23:21:12,"b""Many people don't want to be critical thinkers.\n\nI'm a critical thinker when it comes to my health, I don't trust d\xe2\x80\xa6 https://t.co/1V5b6Zogxm""","Chesapeake, Virginia",0.16666666666666666,0.7000000000000001
2020-04-29 23:19:52,b'#WakeUp people. This is concrete #Corruption. Kiss our country goodbye if this is allowed to stand.\xe2\x80\xa6 https://t.co/v07S3CrFdO',"Westwood, NJ",0.15000000000000002,0.30000000000000004
2020-04-29 23:18:04,b'Describe this in 6 words or less. \n\n#writingcommunity #writingnetwork #writingblock #writing #writechat #ideas\xe2\x80\xa6 https://t.co/7DjXa38VyI',Toronto ON,-0.16666666666666666,0.06666666666666667
2020-04-29 23:17:05,b'How did we get here? One side believes their best interest is to make a virus seem not that bad &amp; the other side de\xe2\x80\xa6 https://t.co/41U2lYWPBJ',"Chicago, IL",0.05833333333333338,0.4472222222222222
2020-04-29 23:14:53,b'just gonna drop this right here :) #trump #bernie #biden #politics #benshapiro #aoc #climatechange #natives #LGBTQ\xe2\x80\xa6 https://t.co/YZZE9luDvW',"Medway, MA",0.39285714285714285,0.7678571428571428
2020-04-29 23:14:00,"b'Dr. Fauci Says He Hopes To Watch Baseball This Summer ""Even If It\'s Only On TV"": Live Updates #Politics #POTUS\xe2\x80\xa6 https://t.co/P3dXRtLRK2'","Washington, DC",0.06818181818181818,0.75
2020-04-29 23:10:17,"b'Dear Diary, Political Committees &amp; the Committees of Political Committees: Groups of politicians that keep minutes,\xe2\x80\xa6 https://t.co/PLjAu1Nogf'",USA & World,0.0,0.1
2020-04-29 23:10:15,"b'Watch Live:  War Room Weekly with Tim Murtaugh, Rand Paul, and more! https://t.co/b6tpgAGEvE #politics #rightsidebroadcastingnetwork'",DC,0.3806818181818182,0.5
2020-04-29 23:10:08,b'Donald Trump: US government doing a great job [Video] https://t.co/y4Lidp7eYK via @360WiseMedia  #360WiseMedia\xe2\x80\xa6 https://t.co/Ya49411Yes',"Miami, FL",0.8,0.75
2020-04-29 23:10:08,b'South Dakota Governor Refused To Implement Stay-At-Home Orders. Her Citizens Throw Her A Parade.\xe2\x80\xa6 https://t.co/DzZesq6zXt',United States,0.0,0.0
2020-04-29 23:08:01,"b'Antibody testing hints at coronavirus\xe2\x80\x99 hellish toll on FDNY/EMS, NYPD\nhttps://t.co/9rIZLwcktQ\n+1 IHeartNYCBot #NY #politics'",Internet,0.0,0.0
2020-04-29 23:07:32,b'Why do they make so much money? #COVID19 #Politics #Congress @realDonaldTrump @DonaldJTrumpJr https://t.co/ItqbXBgzU0',Ohio,0.2,0.2
2020-04-29 23:06:17,"b""People are tired of this #shit of not working cause #govenors don't want to #look bad. #politics is now in #control\xe2\x80\xa6 https://t.co/4fiyc3AH1R""",,-0.4333333333333333,0.7222222222222222
2020-04-29 23:04:16,"b""If You Google 'Ch***ya News Anchor', #ArnabGoswami's Name &amp; Picture Show Up\n#FakeNewsAlert #FakeNews\n#Congress #BJP\xe2\x80\xa6 https://t.co/PTxmMARpCM""",India,0.0,0.0
2020-04-29 23:03:04,"b'Shouting at Trump is a lot like shouting at the TV...you need to write the network, the production company, the dir\xe2\x80\xa6 https://t.co/ILZiONXfN0'",Corner of Sarcasm and Serious,0.0,0.0
2020-04-29 23:03:01,b'Conservatives across America should be furious about this. #2020election #Campaign #China #Coronavirus #DonaldTrump\xe2\x80\xa6 https://t.co/PEKqfUS3jO',United States,0.0,0.0
2020-04-29 23:02:38,"b'You know better @MichaelSteele, this guy is the reason why VP Pence did not wear a mask.\n#Election2020 #VP #Pence\xe2\x80\xa6 https://t.co/lKo89ccfj1'","County Crook, near Chicago",0.5,0.5
2020-04-29 23:02:26,"b""Seems like just a few years ago people were fearing death panels and now they think they're on one. \n\n#COVID19\xe2\x80\xa6 https://t.co/siwFQHClo2""","Oregon, USA",-0.2,0.1
2020-04-29 23:02:24,b'@lblwcri @desifoxx @Passie_Kracht @LailaMickelwait @cebsilver @Forbes Not even complicit...these #Liberal rags HELP\xe2\x80\xa6 https://t.co/muvwrOg6n5',"Washington, DC USA",0.0,0.0
2020-04-29 23:02:02,"b""BREAKING: Coronavirus government response: Trump: WH social distancing guidelines 'fading out': President Donald Tr\xe2\x80\xa6 https://t.co/gpIknN7yH0""",⭕️,0.03333333333333333,0.06666666666666667
2020-04-29 23:00:20,b'Which one of these people causes the most problems for the world?\n#CNN #polls #Twitter #XiJinping #DonaldJTrump\xe2\x80\xa6 https://t.co/iMKU4IamYf',,0.5,0.5
2020-04-29 22:59:10,"b'Chinese state media says Trump ""feels no guilt"" over U.S. coronavirus crisis and has ""failed"" Americans #trump\xe2\x80\xa6 https://t.co/ZnzVC7RkMD'",,-0.25,0.15
2020-04-29 22:58:26,b'The role of #popculture in #politics is actually a very interesting issue... https://t.co/W0SvrXWIYv',Polska,0.65,0.65
2020-04-29 22:58:06,"b""George Bush was terrible, but I believe his supporters could be reached. Trump's supporters, nah - they have to com\xe2\x80\xa6 https://t.co/dzew01qA2j""",,-1.0,1.0
2020-04-29 22:58:04,b'The #libcon party is totally #incapable to deal with the #covid19 crisis in the #US. #Politics',,0.0,0.75
2020-04-29 22:57:04,b'Starting in just a few minutes! #election2020 #socialmedia #politics @AmPublicSquare https://t.co/96zJyiA2zQ',Kansas City ,-0.125,0.1
2020-04-29 22:56:51,b'New York Times Says Biden Campaign Inaccurately Citing Report on Sexual Assault Allegation\xe2\x80\xa6 https://t.co/6dBfEZqab8 #TRoom #politics',United States,0.3181818181818182,0.6439393939393939
2020-04-29 22:56:23,b'For those of you having trouble getting your head around the numbers that\xe2\x80\x99s just over 71 Gary Linekers #bbc\xe2\x80\xa6 https://t.co/36Gm1Mlp8D',London,-0.2,0.2
2020-04-29 22:56:11,b'What do COVID-19 And Abortion Have in Common? Both Can Interrupt a Life Not Yet Lived to its Fullest #life\xe2\x80\xa6 https://t.co/fe73HV6mGS',New Hampshire,-0.3,0.5
2020-04-29 22:55:35,b'Trump administration launching operation to accelerate development of coronavirus vaccine - CNN #Government\xe2\x80\xa6 https://t.co/DYM7jMWazZ',"Washington, DC",0.0,0.0
2020-04-29 22:55:08,b'Mark Zuckerberg is an authoritarian scumbag and the earthly incarnation of Satan. That is all #facebooknews #coronavirus #Politics',"Toronto, Ontario",0.0,0.0
2020-04-29 22:55:03,b'Explosive New Flynn Documents Show FBI Goal Was To \xe2\x80\x98Get Him Fired\xe2\x80\x99 https://t.co/akuQ1Xpuft #politics #opinion https://t.co/FzS8hUX5YI',United States,0.13636363636363635,0.45454545454545453
2020-04-29 22:53:09,b'Democrats: Take The Wash For Amash https://t.co/4hnazcyUOY #Amash #Amash2020 #amashforamerica #election\xe2\x80\xa6 https://t.co/zhPdYXkzqf',"Chico, California",0.0,0.0
2020-04-29 22:51:47,b'#Economics 101: What you missed while sleeping through class\n\n.@thestartup_ .@Medium #medium #politics #government\xe2\x80\xa6 https://t.co/F2A0HTjbAD',,0.0,0.0
2020-04-29 22:50:26,b'IRS Says $158 Billion in Relief Payments Issued Through April 17 https://t.co/cI6h3nHZrI #politics #theepochtimespolitics',DC,0.0,0.0
2020-04-29 22:50:24,b'The Fathering Instinct | Dr. Shawn T. Smith PsyD (Preview)  #21Studios #RedManGroup #the21convention #The21Report\xe2\x80\xa6 https://t.co/0g2PeaFrSy',"Glens Falls, NY",0.0,0.0
2020-04-29 22:48:42,b'New Article: Senate Democrat says Republican leader\xe2\x80\x99s plan to resume work puts lives in danger\xe2\x80\xa6 https://t.co/ZUMoHaDIKB',ask why?,0.13636363636363635,0.45454545454545453
2020-04-29 22:47:33,"b'""The Amash Wash"" is up on @medium #Amash #Amash2020 #amashforamerica #election #Politics #ElectionTwitter\xe2\x80\xa6 https://t.co/vXIzlFhvhb'","Chico, California",0.0,0.0
2020-04-29 22:47:25,"b""While we all argue #COVID19 and #Politics. Countless people are raped, murdered and WORSE. Let's take off the masks\xe2\x80\xa6 https://t.co/yzQiy4rrhy""",Michigan,-0.2,0.55
2020-04-29 22:46:27,b'WATCH: The Bubble Is BURSTING! - Auto Sales PLUNGE As The Housing Market Gets Ready For COLLAPSE!\xe2\x80\xa6 https://t.co/T5YcWCQLWv',,0.2,0.5
2020-04-29 22:46:11,b'Neo-liberalism is a CIA psy-op intended to direct social consciousness back towards the false comfort of conservati\xe2\x80\xa6 https://t.co/svCxB2klrH',Night Loops,-0.06666666666666668,0.26666666666666666
2020-04-29 22:45:03,"b""CrabDiving LIVE y'all!  Kicking the sad, white sack of the right on https://t.co/VDLl4iuxA6 now! #uniteblue #funnynews #politics #headlines""","Florida, USA",0.006899350649350627,0.5089285714285714
2020-04-29 22:43:10,b'French Wuhan Virus Expert REJECTS Second Wave Fears Branding Warnings a \xe2\x80\x98Fantasy\xe2\x80\x99\xe2\x80\xa6 https://t.co/RK5yXPOk7w #TRoom #politics',United States,0.0,0.0
2020-04-29 22:43:03,"b'Is anyone else concerned that people are making jokes about the virus being fake as if 60,000 real people didnt die\xe2\x80\xa6 https://t.co/ugGQA6XCkM'",𝑩𝑼𝑹𝑮,-0.15,0.65
2020-04-29 22:40:50,"b'#Politics - Republican candidate for Blaine County Supervisor, Richard Dalton suspends his campaign and endorses DN\xe2\x80\xa6 https://t.co/H6USxFAeqq'",San Andreas,0.0,0.0
2020-04-29 22:40:05,"b""Sam Noor keeps his double lives separate with expert precision. But when the MI6 agent's wife discovers the lie, he\xe2\x80\xa6 https://t.co/u8vN7JXsc1""",Worldwide,0.0,0.0
2020-04-29 22:37:59,b'#CCOT This is the Nazi America the Liberals and socialists want. #politics #Election2020 #socialdistancing #covid19\xe2\x80\xa6 https://t.co/1Q3und8Vqi',New Jerusalem,0.0,0.0
2020-04-29 22:36:17,b'@jaketapper I guess the possibility of being VP outweighs #MeToo. I thought we were told we had to believe.. \xf0\x9f\xa4\xb7\xf0\x9f\x8f\xbb\xe2\x80\x8d\xe2\x99\x82\xef\xb8\x8f #Kavanaugh #Politics',"Knoxville, TN",0.0,0.0
2020-04-29 22:33:09,b'Why on Earth Would the Southern Poverty Law Center Have $162M Stashed in Offshore Accounts\xe2\x80\xa6 https://t.co/pcESA4dO59 #TRoom #politics',United States,-0.05,0.05
2020-04-29 22:33:03,"b""DAILY EXPRESS - #headlines #nation #politics North Korean defector exposes new sign leader Kim Jong-un is 'no longe\xe2\x80\xa6 https://t.co/vD9CNb2Dhh""","Teesdale Park, Thornaby, UK",0.06818181818181818,0.22727272727272727
2020-04-29 22:33:03,b'This is concerning. #2020election #China #Democrats #HunterBiden #JoeBiden #politics #USNews https://t.co/qttKg5TExQ',United States,0.0,0.0
2020-04-29 22:32:52,"b'Almost 50 years ago people were saying America is not ready for a female president. #America, how come you are stil\xe2\x80\xa6 https://t.co/lRpodzVXNe'",,-0.05,0.3333333333333333
2020-04-29 22:32:51,"b'Who is watching Mrs. America on Hulu?! I love everything about this show \xe2\x80\x93 the era, the cast, the story based on re\xe2\x80\xa6 https://t.co/L93M8VsSYq'",,0.5,0.6
2020-04-29 22:32:26,"b'AREA 51\n\nOn June 17, 1959, a headline published on the Reno Evening Gazette read: More Flying Objects Seen In Clark\xe2\x80\xa6 https://t.co/j8Wu2sdltK'",iCloud,0.5,0.5
2020-04-29 22:31:49,b'The website for my re-election campaign is up &amp; running! Take a look to find out more about me &amp; support my campaig\xe2\x80\xa6 https://t.co/vubrpcPwQZ',"Altamonte Springs, FL",0.5,0.5
2020-04-29 22:31:02,b'Steele Gave New Details About Clinton Ally\xe2\x80\x99s Interest in the Dossier\xe2\x80\xa6 https://t.co/q3QZlmt5P2 #TRoom #politics',United States,0.13636363636363635,0.45454545454545453
2020-04-29 22:30:10,b'Toronto\xe2\x80\x99s refugee hotel: Where are the fines for breaking social distancing? https://t.co/vMzT1aw569 #politics #therebelmedia',DC,0.03333333333333333,0.06666666666666667
2020-04-29 22:30:05,b'Pat &amp; Ryan are LIVE RIGHT NOW w/ LIBERAL #NEWS --&gt; https://t.co/VDLl4iuxA6 #CTL #funnynews #politics',"Florida, USA",0.21103896103896103,0.5178571428571428
2020-04-29 22:27:59,"b'by yours truly, xx\n#Tocsinmag #COVID19 #breakingnews #politics #china #USA https://t.co/B1hPzsS05H'",,0.0,0.0
2020-04-29 22:27:57,b'What\xe2\x80\x99s going on with #politics un #Latam #Markets? Sustainable practices and building strong socially responsible m\xe2\x80\xa6 https://t.co/VDdEvW1OWg',USA ,0.31666666666666665,0.6416666666666666
2020-04-29 22:27:30,"b'@CNN These are not days for #politics or #nonsense - leading requires bringing people together, solving problems.'","Santa Clara, CA",0.0,0.0
2020-04-29 22:27:09,b'The #punishment of #intelligible is that they abstain from #politics and allow the #unintelligible to #govern them.\xe2\x80\xa6 https://t.co/2aPfs3fCLH',"Accra, Ghana",0.0,0.0
2020-04-29 22:26:07,b'You know who didn\xe2\x80\x99t rape anyone?\n\nBernie Fucking Sanders\n\n@DNC #politics',"Pittsburgh, PA",-0.6,0.8
2020-04-29 22:24:45,b'\xe2\x80\x98Hollywood Has Been Complicit\xe2\x80\x99: Ted Cruz Targets Hollywood and China with New Legislation\xe2\x80\xa6 https://t.co/a9ztFcqnta #TRoom #politics',United States,0.13636363636363635,0.45454545454545453
2020-04-29 22:22:57,"b""Can\xe2\x80\x99t believe how many times this has been viewed!! Check out Dollie Dollie's video! #TikTok #politics #donlemon\xe2\x80\xa6 https://t.co/pu2AMKyldg""",,0.9765625,0.5
2020-04-29 22:20:32,b'Our daughter sporting our new merch. Support the channel by purchasing one of your own.\n\nhttps://t.co/eL6Tn0uE5t\xe2\x80\xa6 https://t.co/B3LwJw7oHE',"Las Vegas, NV",0.36818181818181817,0.7272727272727273
2020-04-29 22:20:32,b'Minister squirms like a worm on a hook and shows the callous and deceitful natures of people in the #UK cabinet. Th\xe2\x80\xa6 https://t.co/fWEikDWSDx',"Washington, DC",0.0,0.0
2020-04-29 22:17:56,"b'""Trump v Fox News: why the president is furious at the conservative network"":\nhttps://t.co/pcsAjZrjdI #media #politics'",California,0.0,0.0
2020-04-29 22:17:41,b'Get Rid of #Homelessness for Good @pensignal\n\n@Medium #medium #Homeless #Poverty #Charity #Housing #news #politics\xe2\x80\xa6 https://t.co/H1BU527wRR',,0.7,0.6000000000000001
2020-04-29 22:17:28,b'Cuomo Claims He Didn\xe2\x80\x99t Know About New York Rule Forcing Nursing Homes to Accept Elderly with COVID-19\xe2\x80\xa6\xe2\x80\xa6 https://t.co/zyO6hazHGb',United States,0.13636363636363635,0.45454545454545453
2020-04-29 22:15:41,b'Why does this remind of a certain Sri Lanka politician? \xf0\x9f\x98\x82\xf0\x9f\x98\x82\xf0\x9f\x98\x82\n\n#Politics #SriLanka #lka https://t.co/uDvcJDuqMf',Sri Lanka,0.21428571428571427,0.5714285714285714
2020-04-29 22:12:13,"b'FBI Docs Show Extensive Efforts to Surveil Roger Stone, But Zip, Zero, Zilch Evidence of Collusion\xe2\x80\xa6 https://t.co/FRmFRN2Hoi #TRoom #politics'",United States,0.0,0.3333333333333333
2020-04-29 22:12:07,b'@queerthoughts @theJagmeetSingh .@bcpoli #vanpoli #britishcolumbia #abpoli #polqc #ontario #ottawa #onpoli #topoli\xe2\x80\xa6 https://t.co/jpBGYuZY0p',Toronto,0.0,0.0
2020-04-29 22:10:09,"b'Thousands Defy Stay-At-Home Order And Pack Riverbanks In NYC To See Flyover By Thunderbirds, Blue Angels\xe2\x80\xa6 https://t.co/5IgwIwBT0P'",United States,0.0,0.1
2020-04-29 22:09:50,b'@CBCAlerts See how the @CBCNews coverage compares against other news outlets on Ground News #NATO #Military\xe2\x80\xa6 https://t.co/4CSSaKMguP',,-0.125,0.375
2020-04-29 22:08:12,"b'This is an outrage! @BorisJohnson kicked the can down the road, was indecisive, had no stockpiles, had no testing a\xe2\x80\xa6 https://t.co/fCvUHq0dnz'","Washington, DC",-0.15555555555555559,0.2888888888888889
2020-04-29 22:07:23,b'Greta and/or her handlers trying to stay relevant....\n#bcpoli #vanpoli #abpoli #polqc #ontario #ottawa #onpoli\xe2\x80\xa6 https://t.co/wiwWHySQxe',"Spuzzum, British Columbia",0.4,0.9
2020-04-29 22:07:07,"b""In this episode, we discuss why @JoeBiden is the right person to beat @realDonaldTrump; Paul's relationship with on\xe2\x80\xa6 https://t.co/nvPQAFnAAz""","Hershey, PA",0.2857142857142857,0.5357142857142857
2020-04-29 22:07:06,"b'Alaska School Board Removes 5 Books From Classrooms, Including \xe2\x80\x98The Great Gatsby\xe2\x80\x99\xe2\x80\xa6 https://t.co/u5ucSdeQ4l #TRoom #politics'",United States,0.8,0.75
2020-04-29 22:06:53,"b""Listen to me #Americans: \n#COVID19 and #politics don't mix. \nPeople dying shouldn't benefit anyone (except the unde\xe2\x80\xa6 https://t.co/Q8UAAHjT0i""",online,0.0,0.0
2020-04-29 22:03:50,b'#CCOT Fourth Turnings always climax with an existential crisis that either destroys the country or results in its r\xe2\x80\xa6 https://t.co/Zh8JbV96ju',New Jerusalem,0.0,0.0
2020-04-29 22:01:47,b'The NY Times Used to Correct Its Whoppers. But Not These Two. Here\xe2\x80\x99s Why\xe2\x80\xa6 https://t.co/eHL9Ub8E6W #TRoom #politics',United States,0.0,0.0
2020-04-29 22:00:54,"b'@copyandconsult Mad and just plain depressing isn\xe2\x80\x99t it, Harkers ... even if it was always in short supply, we\xe2\x80\x99ve wi\xe2\x80\xa6 https://t.co/vLEuVjbhJJ'",Overcast regions of the mind,-0.35982142857142857,0.6392857142857142
2020-04-29 22:00:09,b'CPF thanks Spring 2020 Fellow David Hill for a wonderful semester and for sharing his political insights with the C\xe2\x80\xa6 https://t.co/ddG3txn8gY',USC,0.39999999999999997,0.43333333333333335
2020-04-29 22:00:06,b'#politics #government Black caucus moves to front and center in COVID fight: Members of the Congressional Black Cau\xe2\x80\xa6 https://t.co/1lnIzb4abJ',Philadelphia PA,-0.14444444444444446,0.32222222222222224
2020-04-29 22:00:02,b'Government of Alberta named most secretive provincial government in Canada @caj  - https://t.co/VNnTD5o6Jq #Ontario #Politics',Terrebonne,0.5,0.5
2020-04-29 21:59:25,b'And the cost will be passed on to you. Pipe is cheaper.\n#bcpoli #vanpoli #abpoli #polqc #ontario #ottawa #onpoli\xe2\x80\xa6 https://t.co/W2GDRDqitT',"Spuzzum, British Columbia",0.0,0.0
