2020-04-29 15:13:36,"b""Better to light a small candle than wasting your time cursing the darkness. So let's come together to #MakeAChange\xe2\x80\xa6 https://t.co/L1ZNUlLZfo""",,0.21666666666666667,0.5333333333333333
2020-04-29 15:12:59,b'\xe2\x80\x9cListening to the science is a very important part of your job\xe2\x80\x9d @MattHancock #covid19 #coronavirus #politics #art\xe2\x80\xa6 https://t.co/9lo5cXZMRF',London,0.52,1.0
2020-04-29 15:12:49,b'#CCOT Evidence that the Chinese conducted dangerous virus experiments with the help of the Obama Administration.\xe2\x80\xa6 https://t.co/Ap1DpRi5wZ',New Jerusalem,-0.3,0.45
2020-04-29 15:12:16,b'New Article: Democrats push for U.S. coronavirus supply czar to oversee key medical needs \n\nhttps://t.co/HOUXWu5GwV\xe2\x80\xa6 https://t.co/QDvxfgw4XC',ask why?,0.04545454545454545,0.48484848484848486
2020-04-29 15:11:57,b'are we all down here to be murdered ? just saying #Politics',,-0.15555555555555559,0.2888888888888889
2020-04-29 15:11:18,"b'The Trump administration has quietly agreed to give 800,000 masks to truck drivers after moths of ignoring requests\xe2\x80\xa6 https://t.co/3HBBGx196Y'","Washington, DC",0.0,0.3333333333333333
2020-04-29 15:10:25,"b'Trump: Dems \xe2\x80\x98enjoying\xe2\x80\x99 vacation, should come back [Video] https://t.co/eK1aUFPI9a via @360WiseMedia  #360WiseMedia\xe2\x80\xa6 https://t.co/cmExXfltLz'","Miami, FL",0.25,0.3
2020-04-29 15:10:12,"b'Poland to reopen hotels, malls https://t.co/ivWMEC6ENj #Politics https://t.co/eQQT8822Zi #Poland #to #reopen #hotels #malls #  501'",World,0.0,0.0
2020-04-29 15:10:12,b'President announces end of state of emergency in Portugal https://t.co/dgV2TgN5Av #Politics https://t.co/eQQT8822Zi\xe2\x80\xa6 https://t.co/uRLNPh4kCV',World,0.0,0.0
2020-04-29 15:10:08,"b'Montenegro to reopen hotels, restaurants on May 18 https://t.co/MMdy4UL0Yx #Politics https://t.co/eQQT8822Zi\xe2\x80\xa6 https://t.co/G58hsWZF2k'",World,0.0,0.0
2020-04-29 15:10:08,"b'Hungary, China sign loan deal for Budapest-Belgrade rail project https://t.co/6s9gpiUbz1 #Politics\xe2\x80\xa6 https://t.co/JOdkrMz2lg'",World,0.0,0.0
2020-04-29 15:10:05,b'Quest Diagnostics Begins Selling COVID-19 Antibody Tests https://t.co/QoHCVfElDf #news #politics #opinion https://t.co/4o6R4hMXzp',United States,0.0,0.0
2020-04-29 15:10:03,b'Putin extends national paid leave to May 11 https://t.co/VNFvi2EPxq #Politics https://t.co/eQQT8822Zi #Putin\xe2\x80\xa6 https://t.co/QbOnT72iUb',World,0.0,0.0
2020-04-29 15:08:17,"b""Compare the news side-by-side to see who's telling the whole story. Comment on bias or under-reporting. Share to su\xe2\x80\xa6 https://t.co/wTMdc7qcdt""",,0.2,0.4
2020-04-29 15:07:46,"b'Homeless, a short film, written, performed and directed by Luis Lassen. #buzzfeed #housing #equality #opportunity\xe2\x80\xa6 https://t.co/ZrAmjXMoZR'",New York,0.0,0.3
2020-04-29 15:06:19,"b'US body accuses India of violating religious freedoms, India calls it biased https://t.co/5ZiZKMElNx #national #Politics via @tfipost'","Srinagar, Jammu And Kashmir",0.0,0.25
2020-04-29 15:05:38,b'The #Caribbean and #TrinidadandTobago  response to  #COVID2019 is renewing the #politics versus #science challenge. https://t.co/aiHfqSLQwe',Trinidad and Tobago,0.0,0.0
2020-04-29 15:04:36,b'How many coronavirus cases have been reported in each U.S. state? via @politico \nhttps://t.co/C0WCZgsvav\n#US\xe2\x80\xa6 https://t.co/Q4hXz3ZCaJ',,0.5,0.5
2020-04-29 15:03:25,"b""Reason:  The COVID-19 Pandemic Didn't Stop This California Cop From Getting Physical During a Teen Smoking Arrest\xe2\x80\xa6 https://t.co/aCrlkjMVUZ""",Maryland,0.0,0.07142857142857142
2020-04-29 15:02:50,"b'#ThisDayinQuiztory April 29, 1922\n\nToday we celebrate Congressman Parren Mitchell, the first African American elect\xe2\x80\xa6 https://t.co/hsYhbMtMJf'",App Store/Google Play,0.08333333333333333,0.1111111111111111
2020-04-29 15:01:21,b'Check out the recent issue articles from International Studies. #InternationRelations #Politics https://t.co/8JxGt0gmMf',,0.0,0.125
2020-04-29 15:00:50,b'The virus is not a hoax. The complete shutdown/hysteria is!\n@donaldjtrumpjr @realdonaldtrump \n#freedom #maga\xe2\x80\xa6 https://t.co/JQblx2QYUc',,0.125,0.4
2020-04-29 15:00:24,"b'@e_whittler #Politics \n\nThis might be a good time to remind everyone that ""we democrats must stick together"" is jus\xe2\x80\xa6 https://t.co/Xcng1sittg'",,0.7,0.6000000000000001
2020-04-29 15:00:21,"b'It would be na\xc3\xafve to think that, after this crisis has passed, Western relations with Beijing can return to the sta\xe2\x80\xa6 https://t.co/MBh9UgW4KP'","New York, NY",0.0,0.0
2020-04-29 15:00:03,b'READ\n#NEWNORMAL #POLITICS https://t.co/dcmIuO5po7 https://t.co/A0fNenpkPs',,0.0,0.0
2020-04-29 14:59:55,"b'Social distancing got you down?\nTo pick yourself up, download SEX and the AMERICAN MALE, the satirical e-book about\xe2\x80\xa6 https://t.co/97Qr5uqHIO'",Austin,-0.030555555555555565,0.1138888888888889
2020-04-29 14:59:11,b'Police disperse crowd after scores turn out for funeral of rabbi in New York #politics #news #USPolitiHUB https://t.co/Zb1ax1G00L',,0.13636363636363635,0.45454545454545453
2020-04-29 14:59:02,b'.....with the hope of getting a job with their help or using their influence somewhere which again is a waste of ti\xe2\x80\xa6 https://t.co/hdLjDxM7Uj',"Tamil Nadu, India",-0.2,0.0
2020-04-29 14:57:39,b'New Politics Essay Walkthrough lesson available now: https://t.co/hQJ2D6aopm\n\n#alevels2021 #Politics #PoliticsLive\xe2\x80\xa6 https://t.co/rW3eKT94RL',,0.2681818181818182,0.42727272727272725
2020-04-29 14:57:01,b'The left is trying to revise history. #AlexandriaOcasioCortez #BusinessandMoney #BusinessesandCompanies #Congress\xe2\x80\xa6 https://t.co/gisjQk0T9A',United States,0.0,0.0
2020-04-29 14:55:47,b'Stumbled on this speech. Julia Gillard was a powerful speaker and totally murdered  (metaphorically speaking) Tony\xe2\x80\xa6 https://t.co/zD4Gdvslfb',"Yorkshire and The Humber, Engl",0.09999999999999999,0.65
2020-04-29 14:55:43,b'Bill De Blasio Should Resign Over His Anti-Semitic Tweet https://t.co/bEtHk3bIpy #politics #opinion https://t.co/M5K2hBJugm',United States,0.0,0.0
2020-04-29 14:55:41,"b'In 1950, Americans Had Aspic. Now We Have Dalgona Coffee. https://t.co/cVPJzd6QGJ #politics #feedly'","San Fernando, CA",0.0,0.0
2020-04-29 14:55:19,b'No lies detected here. #thatsthescenario #independentradio #BlackRadio #coronavirus #Rona #Covid19\xe2\x80\xa6 https://t.co/G3UXq1hZAF',Nashville TN,0.0,0.0
2020-04-29 14:54:37,b'#Politics really does make people INSANE. People rabidly defending their side no matter what. Rabidly insulting and\xe2\x80\xa6 https://t.co/7E551JMIm3',Everywhere,-0.6,0.7333333333333334
2020-04-29 14:54:13,"b""#Politics #Government #Campaigns #Election2020 @JoeBiden --&gt; Socialists Shouldn't Endorse Joe Biden https://t.co/PHoZBZefYz""","Los Angeles, CA",0.0,0.0
2020-04-29 14:52:58,"b'Although the world is full of suffering, it is also full of the overcoming of it.\n\n#zarakhan #auratawaz #Pakistan\xe2\x80\xa6 https://t.co/dfHIR3FmfS'",,0.35,0.55
2020-04-29 14:52:57,b'Uddhav Thackeray spoke to Prime Minister Narendra Modi and sought his help in mitigating a brewing political instab\xe2\x80\xa6 https://t.co/89MNJhmgE6',India,0.0,0.1
2020-04-29 14:52:09,b'Love this more and more... #capitalism #neoliberalism #Politics #Covid_19 https://t.co/tOtjjtrBye',"California, USA",0.5,0.5333333333333333
2020-04-29 14:51:29,"b'I am neither a #Democrat or a #Republican, I am an #Independent as it is more difficult for an #independent to be p\xe2\x80\xa6 https://t.co/rA9TyzA6mS'",,0.0,0.4375
2020-04-29 14:48:42,"b""It's always so funny to get these kinds of replies from political assholes, only for them to block me afterwards. S\xe2\x80\xa6 https://t.co/PTAwEf63hJ""",Earth,0.08333333333333333,0.7000000000000001
2020-04-29 14:47:53,b'@Thomas1774Paine how to create third world countries #politics',,0.0,0.0
2020-04-29 14:46:55,"b""#VIDEO - Coronavirus: \xe2\x80\x98China is not the enemy of the United States' via @BBCNews \nhttps://t.co/Ptc311FY0z\n#China\xe2\x80\xa6 https://t.co/ViBDqEoepG""",,0.0,0.0
2020-04-29 14:45:14,b'India coronavirus lockdown: Stranded migrants can return home via @BBCNews \nhttps://t.co/VYYu7NgIqX\n#India\xe2\x80\xa6 https://t.co/Ao7Vcnsrib',,0.0,0.0
2020-04-29 14:45:10,b'Donald Trump: \xe2\x80\x98We Will Make the Energy Business Great Again\xe2\x80\x99 https://t.co/rPrTC58fK6 #breitbart #politics',DC,0.8,0.75
2020-04-29 14:45:05,b'Wake up w/ the All-Star Political Panel! Every Friday @ 8:45 LIVE from Circuit World.\n#Politics #Party #Trump\xe2\x80\xa6 https://t.co/EKdC2jqlGu',"Ellijay, GA",0.06818181818181818,0.3
2020-04-29 14:45:04,"b'#politics #government FDA Reportedly Partners With Gilead To ""Quickly"" Make Remdesivir Widely Available: FDA Report\xe2\x80\xa6 https://t.co/sPBCGgUWac'",Philadelphia PA,0.3666666666666667,0.45
2020-04-29 14:45:00,b'It\xe2\x80\x99s the Economy. Stupid. by @SpikeArt https://t.co/MHKhzC9SZN #TrumpPlague #Coronavirus #TrumpLies #Politics\xe2\x80\xa6 https://t.co/t5AiggtWVP',"Longview, TX",-0.7999999999999999,1.0
2020-04-29 14:43:29,b'This is insane \nI think id like to read the news from military intelligence network instead of social media network\xe2\x80\xa6 https://t.co/UHKTQ31HyN',"Missouri, USA",-0.35555555555555557,0.3888888888888889
2020-04-29 14:42:48,b'Here\xe2\x80\x99s to hoping the 2024 nominees aren\xe2\x80\x99t garbage. \n\n#election #trump #biden #maga #trump2020 #biden2020 #politics #democrats #republicans',"New York, USA",0.0,0.0
2020-04-29 14:42:13,b'Senior Russian official uncovered as MH17 suspect via @BBCNews https://t.co/ghB6P7L2PW\n#Russia #Ukraine #NL #MH17\xe2\x80\xa6 https://t.co/eTHD68jIBV',,0.0,0.0
2020-04-29 14:42:03,"b""Today\xe2\x80\x99s #TipOfTheDay is a #podcast called #KidNuz. This is how it is described, \xe2\x80\x9cFive minutes of today's\xe2\x80\xa6 https://t.co/tbdOxnW0Bp""",Idaho & Eastern Washington,0.0,0.0
2020-04-29 14:40:08,b'Noor has no way of knowing that a supernatural war rages within his nation. And the winner could take charge of hum\xe2\x80\xa6 https://t.co/Kw4v7LnwHf',Worldwide,0.16666666666666666,0.5666666666666667
2020-04-29 14:40:08,b'Trump puts pressure on Adam \xe2\x80\x9cShifty\xe2\x80\x9d to release transcripts of Russia investigation https://t.co/TM8QYOUtrh #politics #therightscoop',DC,0.0,0.0
2020-04-29 14:40:03,"b'Political corruption, murder, &amp; lost treasures. Dix &amp; Maria get caught in the middle of it.\n#fiction #murder\xe2\x80\xa6 https://t.co/40eyuV66Cj'",Texas,0.0,0.05
2020-04-29 14:39:46,"b""Germany's new Berlin airport set for take off, nine years late via @BBCNews \nhttps://t.co/IQTVzT43H4\n#Germany\xe2\x80\xa6 https://t.co/knoALWR5qi""",,-0.08181818181818182,0.5272727272727272
2020-04-29 14:39:03,b'\xe2\x80\x98Our time has come!\xe2\x80\x99 Proponents of drinking bleach are giddy about Trump\xe2\x80\x99s disinfectant comments https://t.co/4RoT3uGk6V #politics #feedly',"San Fernando, CA",0.0,0.0
2020-04-29 14:38:44,"b'Key issue: politicians are deciding when #StayAtHome orders are lifted, not #health experts/real #science professio\xe2\x80\xa6 https://t.co/0g5SmRe0Iv'",,0.0,1.0
2020-04-29 14:38:10,b'Patriotism is the last refuge of a scoundrel.\nSamuel Johnson\n#samueljohnson #Politics #HumanRights',"New York, USA",0.0,0.06666666666666667
2020-04-29 14:37:10,"b""Biden Campaign Says Former VP Is a 'Champion for Women' As Controversy Over Sexual Assault Allegations Deepens\xe2\x80\xa6 https://t.co/HviRdyU9y3""","San Fernando, CA",0.25,0.4166666666666667
2020-04-29 14:36:16,b'I would pay anything for five minutes alone with any of you bastards. To kick the crap out of you. You\xe2\x80\x99re killing m\xe2\x80\xa6 https://t.co/lq9UTbSuPc',New York City,-0.8,0.8
2020-04-29 14:36:05,b'Congressman: Americans shouldn\xe2\x80\x99t be fined for not wearing masks https://t.co/Gz2J0RWfiR #justthenews #politics',DC,0.0,0.0
2020-04-29 14:35:23,"b'Former Chairman of Michelin North America Drops Support for Lindsey Graham, Backs Democratic Challenger\xe2\x80\xa6 https://t.co/Kd58nOPuBB'","San Fernando, CA",0.0,0.0
2020-04-29 14:35:12,"b'Poland to reopen hotels, malls https://t.co/ivWMEC6ENj #Politics https://t.co/eQQT8822Zi #Poland #to #reopen #hotels #malls #  626'",World,0.0,0.0
2020-04-29 14:35:12,b'President announces end of state of emergency in Portugal https://t.co/dgV2TgN5Av #Politics https://t.co/eQQT8822Zi\xe2\x80\xa6 https://t.co/ND3vYtgoxV',World,0.0,0.0
2020-04-29 14:35:08,"b'Montenegro to reopen hotels, restaurants on May 18 https://t.co/MMdy4UL0Yx #Politics https://t.co/eQQT8822Zi\xe2\x80\xa6 https://t.co/sr6qBLaxwa'",World,0.0,0.0
2020-04-29 14:35:08,"b'Hungary, China sign loan deal for Budapest-Belgrade rail project https://t.co/6s9gpiUbz1 #Politics\xe2\x80\xa6 https://t.co/I7aS3iYRQb'",World,0.0,0.0
2020-04-29 14:35:03,b'Putin extends national paid leave to May 11 https://t.co/VNFvi2EPxq #Politics https://t.co/eQQT8822Zi #Putin\xe2\x80\xa6 https://t.co/ZDoUsCPQPG',World,0.0,0.0
2020-04-29 14:34:34,"b'NBC praised China for its medical supplies. Turns out, Chinese COVID-19 tests don\xe2\x80\x99t work, masks are defective.\xe2\x80\xa6 https://t.co/TumIysYmIx'",At Your Fingertips,0.0,0.0
2020-04-29 14:34:20,"b'From today I am thinking of sharing some of  movie clips , sport videos which I loved most. \n#movies #sports #Politics'",చేపల చెరువు,0.6,0.65
2020-04-29 14:34:10,b'N.C.A.A. Outlines Plan to Let Athletes Make Endorsement Deals https://t.co/JWzELJCEFg #politics #feedly',"San Fernando, CA",0.0,0.0
2020-04-29 14:33:38,b'Why is it called \xe2\x80\x9cpolitics\xe2\x80\x9d to point out someone doesn\xe2\x80\x99t use capital letters right?? Is my 10 year old cousin going\xe2\x80\xa6 https://t.co/qcgahlgxvm',"New York, NY",0.19285714285714284,0.3678571428571429
2020-04-29 14:32:53,b'Reason:  Justin Amash Becomes the First Libertarian Member of Congress https://t.co/nHCQeZDzex #Gop2012 #Tcot #Tlot\xe2\x80\xa6 https://t.co/ACo1hmWjua',Maryland,0.25,0.3333333333333333
2020-04-29 14:31:03,b'Coronavirus: Welsh ministers refuse to expand care home testing via @BBCNews \nhttps://t.co/HufEIozSS0\n#Wales #UK\xe2\x80\xa6 https://t.co/rxT2h0ptxt',,0.0,0.0
2020-04-29 14:30:42,"b""\xe2\x97\x8f NEWS \xe2\x97\x8f #truthout #politics \xe2\x98\x9e #Trump and #McConnell Aren't Waging War on COVID. They're Waging War on Us. https://t.co/XvENLzK9Nt""",North Pole,0.0,0.0
2020-04-29 14:30:10,b'Coronavirus: Why is Wales not testing over 65s as in England? via @BBCNews \nhttps://t.co/JAuCOIeHtB\n#Wales #UK #NHS\xe2\x80\xa6 https://t.co/FPNfpEdHCh',,0.0,0.0
2020-04-29 14:30:07,"b'Dems Will Freak: Trump Yanks Millions from WHO, Is Giving to Orgs Like Rev. Graham\xe2\x80\x99s Samaritan\xe2\x80\x99s Purse\xe2\x80\xa6 https://t.co/5THKJCBamm'",DC,0.0,0.0
2020-04-29 14:30:01,"b""The US reopening is coming, but 'normal' is still a ways off -- https://t.co/Fqr6uLY0xK #NationalNews #Politics""","West Monroe, La",0.15,0.6499999999999999
2020-04-29 14:27:28,b'@JohnCarneyDE no money for breakfast.  #selfemployed the forgotten group in #Delaware.  Where is our share of\xe2\x80\xa6 https://t.co/yyuZ5y12Av',,0.0,0.0
2020-04-29 14:27:24,b'The Troubles: MPs are to investigate legacy approach via @BBCNews https://t.co/WqLUAH0KEj\n#NI #UK #Ireland\xe2\x80\xa6 https://t.co/93LlLzh3Xn',,0.0,0.0
2020-04-29 14:27:02,"b'Read the tweets...on #politics #presidenttrump\nAnd you wonder why we ""As Americans"" can not agree, always want 2 bl\xe2\x80\xa6 https://t.co/HvlTLf8jg9'","Atlanta, Georgia",0.0,0.0
2020-04-29 14:26:40,"b'New Article: Democrats unveil bill requiring U.S. coronavirus supply czar \n\nhttps://t.co/oNteKbBmr6 \n\n#Politics April 29, 2020'",ask why?,0.13636363636363635,0.45454545454545453
2020-04-29 14:26:16,"b""Coronavirus: Testing in NI is 'significantly ramped up' via @BBCNews https://t.co/6E7xmGK9vi\n#NI #UK #Ireland #NHS\xe2\x80\xa6 https://t.co/xzUdhe12GG""",,0.375,0.875
2020-04-29 14:24:16,b'South Korea Cautions On Kim Jong Un Rumours https://t.co/5IDhdrRpcz\n#Africa #Politics #politidk #NorthKorea\xe2\x80\xa6 https://t.co/Ug0MjA2sak',Africa,0.0,0.0
2020-04-29 14:23:04,b'I saw many states passing illogical resolutions against CAA. \n\nI wonder what stops them in amending Epidemic Act in\xe2\x80\xa6 https://t.co/2OKYfhieTr',TimBuckToo,0.5,0.5
2020-04-29 14:22:26,"b""Coronavirus: Lockdown will ease 'when time right for NI' via @BBCNews https://t.co/a3nZRgyTST\n#NI #UK #Ireland #NHS\xe2\x80\xa6 https://t.co/hHnh6keFGp""",,0.2857142857142857,0.5357142857142857
2020-04-29 14:20:41,b'Queen to lead VE Day 75th anniversary events via @BBCNews \nhttps://t.co/OvRLXb1gCh\n#UK #remembrances #memorials\xe2\x80\xa6 https://t.co/V2YzkYaZYk',,0.0,0.0
2020-04-29 14:19:00,b'I agree with Alastair Campbell on #AfternoonLive #BBCNews:\nBoris Johnson &amp; his unmarried partner Carrie Symonds &amp; t\xe2\x80\xa6 https://t.co/04wcAXvL8O',"England, Britain, Albaria",0.0,0.0
2020-04-29 14:18:25,"b'Has Western global dominance come to an end?\n.\nWatch @mahbubani_k two part video interview with @FullFrameCGTN, the\xe2\x80\xa6 https://t.co/DktTKywZ4Z'",New York,0.0,0.0
2020-04-29 14:17:49,"b""@nprpolitics @VP - Since you son't seem to know what the rest of the nation is doing, you know you don't put the ma\xe2\x80\xa6 https://t.co/xt51ILU2lB""",,0.0,0.0
2020-04-29 14:17:43,b'This afternoon  Gov. @henrymcmaster will hold the first meeting of the #accelerateSC Response team. Meeting starts\xe2\x80\xa6 https://t.co/F1RjYKQntU',"Charleston, SC",0.25,0.3333333333333333
2020-04-29 14:17:39,b'Reason:  The First Federal Female Inmate To Die of COVID-19 https://t.co/jG8ZHcWWmv #Gop2012 #Tcot #Tlot #jobs\xe2\x80\xa6 https://t.co/aACLSotyOg',Maryland,0.125,0.25
2020-04-29 14:16:30,b'Debbie Hines breaks down why @JoeBiden needs a black woman as his running mate on this @fox5dc segment.\xe2\x80\xa6 https://t.co/oVoXxPxKJ3',"New York, NY",-0.16111111111111112,0.36111111111111116
2020-04-29 14:16:02,b'The #Biden campaign is going to pull out all the stops to silence/ intimidate #TaraReade \n\nThey\xe2\x80\x99ll say it\xe2\x80\x99s been \xe2\x80\x9cd\xe2\x80\xa6 https://t.co/RKNyzubaFq',"Pittsburgh, PA",0.0,0.0
2020-04-29 14:15:46,b'Whirlpool: New warning over fire-prone Hotpoint washing machines via @BBCNews \nhttps://t.co/t1BWCBqf2Z\n#UK\xe2\x80\xa6 https://t.co/R00wvLilKD',,0.13636363636363635,0.45454545454545453
2020-04-29 14:15:32,"b'BREAKING: Navy to widen carrier probe, delaying decision on commander: The Navy has decided to conduct a legal inve\xe2\x80\xa6 https://t.co/LHkfvEWCXK'",⭕️,0.2,0.2
2020-04-29 14:15:12,b'Great to see that @YouTube is censoring #science and informed decision because it doesn\xe2\x80\x99t align with their\xe2\x80\xa6 https://t.co/6XeLsKjdZ1',"Hesperia, CA",0.8,0.75
2020-04-29 14:15:07,b'The incompetence pandemic - The first victim of the coronavirus? - Leadership \nhttps://t.co/2Jj5P2tU8k \n@politico  #politics #covid19',"Toronto, Canada",0.0875,0.19166666666666665
2020-04-29 14:12:53,"b""Coronavirus 'will hasten the decline of cash' via @BBCNews https://t.co/0DvZBwriv5\n#Scotland #UK #finance #currency\xe2\x80\xa6 https://t.co/dZaY9qqIhJ""",,0.0,0.0
2020-04-29 14:12:38,b'Thank you #Jesus for dying for my sins and giving me a new life where I can trust you during things like #pandemics #Wars and #Politics',Southern California,0.13636363636363635,0.45454545454545453
2020-04-29 14:12:26,"b""In these times of dirty political propaganda and dating site, isn't it acknowledgeable that truth and love is a lux\xe2\x80\xa6 https://t.co/AhZuz9cKYE""","Chandigarh, India",-0.04999999999999999,0.4
2020-04-29 14:11:13,b'Coronavirus: EnQuest warns of more than 500 North Sea redundancies via @BBCNews \nhttps://t.co/o8KUT1Y8Xb\n#Scotland\xe2\x80\xa6 https://t.co/QPiuoGfazV',,0.5,0.5
2020-04-29 14:10:16,b'POLL: what issue is most important to you in 2020?\n\n#polling #Election2020 #Issue #VoteBlue2020 #vote #wipolitics\xe2\x80\xa6 https://t.co/FbiTjEiwmh',"Milwaukee, WI",0.45,0.75
2020-04-29 14:10:14,"b'Howard Stern Backs Biden, Says Trump And His Supporters Should Drink Bleach And Die https://t.co/MIGBYx5TKc #news\xe2\x80\xa6 https://t.co/9a0Wrqkko7'",United States,0.0,0.0
2020-04-29 14:10:14,b'Trump orders U.S. meat-processing plants to stay open despite coronavirus fears [Video] https://t.co/dPWpxFw9cB via\xe2\x80\xa6 https://t.co/7NpQ4GJeyj',"Miami, FL",0.0,0.5
2020-04-29 14:10:13,"b'Poland to reopen hotels, malls https://t.co/ivWMEC6ENj #Politics https://t.co/eQQT8822Zi #Poland #to #reopen #hotels #malls #  23'",World,0.0,0.0
2020-04-29 14:10:12,b'President announces end of state of emergency in Portugal https://t.co/dgV2TgN5Av #Politics https://t.co/eQQT8822Zi\xe2\x80\xa6 https://t.co/wf8n7TmiYj',World,0.0,0.0
2020-04-29 14:10:08,"b'Montenegro to reopen hotels, restaurants on May 18 https://t.co/MMdy4UL0Yx #Politics https://t.co/eQQT8822Zi\xe2\x80\xa6 https://t.co/NvfMHNwhcK'",World,0.0,0.0
2020-04-29 14:10:08,"b'Hungary, China sign loan deal for Budapest-Belgrade rail project https://t.co/6s9gpiUbz1 #Politics\xe2\x80\xa6 https://t.co/kzj4KdI1xM'",World,0.0,0.0
2020-04-29 14:10:03,b'Putin extends national paid leave to May 11 https://t.co/VNFvi2EPxq #Politics https://t.co/eQQT8822Zi #Putin\xe2\x80\xa6 https://t.co/ooWEPJxpTn',World,0.0,0.0
2020-04-29 14:09:53,b'Congress Has Now Introduced 32 Crypto And Blockchain Bills. Is crypto finally starting to get the political backing\xe2\x80\xa6 https://t.co/NRqZfiKe3N',"Sydney, Australia & NYC, USA",0.0,0.1
2020-04-29 14:09:25,"b""Coronavirus: Rise in requests to reveal partners' abusive pasts via @BBCNews \nhttps://t.co/bSzltonmLn\n#Scotland #UK\xe2\x80\xa6 https://t.co/sLgmTURZtH""",,0.0,0.0
2020-04-29 14:08:17,b'Key workers in Cairngorms abused for staying in holiday homes via @BBCNews \nhttps://t.co/uYsllh3cTY\n#Scotland\xe2\x80\xa6 https://t.co/cdjtHWGe5a',,0.0,1.0
2020-04-29 14:07:40,b'This is how kings and queens act in a tyrannical kingdom. This crisis is revealing a lot. #COVID19 #Politics https://t.co/Jz6fvqHSDW',United States,0.0,0.0
2020-04-29 14:07:21,b'There is a key skill you need to develop in #politics. It\xe2\x80\x99s called #management. Can you #manage the #resources entr\xe2\x80\xa6 https://t.co/1BX4MKWqCK',"Manchester, England",0.0,1.0
2020-04-29 14:06:28,b'So There&amp;#8230;anything else? https://t.co/TOMb50nZFj via @bayobserver #hamont #burlont #Michelle_Rempel_Garner\xe2\x80\xa6 https://t.co/I5IhjaM19c',"Hamilton, Ontario",0.0,0.0
2020-04-29 14:06:19,b'Coronavirus in Scotland: Half of deaths now in care homes via @BBCNews \nhttps://t.co/JKxcEuLcH0\n#Scotland #UK\xe2\x80\xa6 https://t.co/2TXkvtptbe',,-0.16666666666666666,0.16666666666666666
2020-04-29 14:06:03,b'Rudy Giuliani Drops a Bomb on NIAID Director Dr. Tony Fauci after discovering he gave $3.7 Million to Wuhan Laborat\xe2\x80\xa6 https://t.co/6tzENB2mJI',"Michigan, USA",0.0,0.0
2020-04-29 14:05:21,b'Coronavirus in Scotland: Who is dying and where? via @BBCNews https://t.co/3WzosnjpWK\n#Scotland #UK #NHS #Covid19\xe2\x80\xa6 https://t.co/FQlMg8pAqA',,0.0,0.0
2020-04-29 14:04:24,b'Virus tests: How do Scotland and England compare? via @BBCNews https://t.co/4pjgtbKcb7\n#Scotland #UK #testing #NHS\xe2\x80\xa6 https://t.co/j2JEuWOzis',,0.0,0.0
2020-04-29 14:02:35,"b""Coronavirus: PM 'focused on PPE delivery' on return to work via @BBCNews https://t.co/JTPSqMvN77\n#UK #NHS #PPE\xe2\x80\xa6 https://t.co/dnuey9XtZB""",,0.0,0.0
2020-04-29 14:02:31,b'Crises never occur in the moment.  A review of how a group of hapless consultants (&amp; even more hapless leaders plod\xe2\x80\xa6 https://t.co/WkE829nYYY',,-0.2333333333333333,0.8333333333333334
2020-04-29 14:01:36,b'#VIDEO - PMQs: Starmer and Raab on UK and Europe death rates via @BBCNews \nhttps://t.co/Gs0OfDZcm3\n#UK #NHS #EU\xe2\x80\xa6 https://t.co/uNMPvq29jX',,0.0,0.0
2020-04-29 14:01:22,b'Passion for #Politics &amp; #Agriculture? Join @CortevaUS in Washington DC as #PoliticalAffairs Manager. Be responsible\xe2\x80\xa6 https://t.co/3mGWrxutgP',,0.0,0.0
2020-04-29 14:00:58,b'US economy shrank at 4.8% rate last quarter as virus struck -- https://t.co/c5VyKsgQSM #NationalNews #Politics',"West Monroe, La",0.0,0.06666666666666667
2020-04-29 14:00:17,"b""Priti Patel probe findings should be made public 'as soon as possible' - Labour via @BBCNews\xe2\x80\xa6 https://t.co/z9TGloDk9b""",,0.0,0.5333333333333333
2020-04-29 13:59:11,b'Incumbent Democrat Joyce Beatty wins Ohio primary against liberal Morgan Harper #democrat #politics #news\xe2\x80\xa6 https://t.co/FmuffweLjT',,0.35,0.35
2020-04-29 13:59:10,"b'Schools will reopen in phases, says Williamson via @BBCNews https://t.co/hGOBodaceu\n#UK #schools #education\xe2\x80\xa6 https://t.co/9P7eHBJ09M'",,0.0,0.0
2020-04-29 13:57:53,b'Coronavirus: Testing opens for millions more people in England via @BBCNews \nhttps://t.co/GMf7iiGOX0\n#UK #testing\xe2\x80\xa6 https://t.co/qmymdCiFma',,0.5,0.5
2020-04-29 13:56:36,"b'With the #Election2020 season upon us, you (and your #party) might be on the prowl for an affordable and efficient\xe2\x80\xa6 https://t.co/vL3olXBmDt'","London, England",0.0,0.0
2020-04-29 13:55:46,b'#ThreatIntel #CyberSecurity #Politics #ReopenAmerica must read https://t.co/HUNWs5FKRA',"Dallas, TX",0.0,0.0
2020-04-29 13:55:27,b'Media Doesn\xe2\x80\x99t Care That People Died Because Cuomo Put Coronavirus Patients In Nursing Homes https://t.co/wDEfH09Opr\xe2\x80\xa6 https://t.co/ioTvR6NenD',United States,0.0,0.0
2020-04-29 13:55:10,b'Rudy Giuliani Drops a Bomb on NIAID Director Dr. Tony Fauci after discovering he gave $3.7 Million to Wuhan Laborat\xe2\x80\xa6 https://t.co/Gj18yfTuLR',,0.0,0.0
