2020-04-29 07:54:04,b'#Tanzania  waving #Flag. National #3D ...\n\n#Animation #Attractions #Beach #Beautiful #Business #City #Country\xe2\x80\xa6 https://t.co/8mKegZwvC0',,0.85,1.0
2020-04-29 07:53:35,b'The Opposition Research Handbook: A Guide to Political Investigations 4th Edition #politicaljobs #politics #research https://t.co/pfa7TwrdJ5',"Haymarket, VA",0.0,0.1
2020-04-29 07:51:47,b'U.S. Federal Reserve program will provide $500B in emergency aid to large corporations without requiring them to pr\xe2\x80\xa6 https://t.co/DXSsXiaqfS',Northern Ireland,0.21428571428571427,0.42857142857142855
2020-04-29 07:51:01,"b'Remember kids, #money, #religion, and #politics are not the first things to discuss on a date. \n\nBut they\xe2\x80\x99re the fi\xe2\x80\xa6 https://t.co/jgm2TeEWi4'",,0.25,0.3333333333333333
2020-04-29 07:50:02,b'Revealed: the 20 firms behind a third of all carbon emissions \n#climatecrisis\n#climatechange\n#climateaction\xe2\x80\xa6 https://t.co/YYLKTzYSIB',"Brussels, Belgique",-0.2,0.35
2020-04-29 07:47:54,"b""It will be interesting to see if the Prime Minister turns up today for PMQ's? #Politics https://t.co/84rq0nEcXy""","Paignton, Devon",0.5,0.5
2020-04-29 07:47:24,b'The river flows around the rock the object that cannot change itself like the river does which flows and turns and\xe2\x80\xa6 https://t.co/wCoAqjJNv4',"Los Angeles, CA",0.0,0.0
2020-04-29 07:43:08,b'\xe2\x80\x98Misleading Data Table\xe2\x80\x99 a new lockdown sculpture from Herding Brains. Check out our #creativity approach at our FRE\xe2\x80\xa6 https://t.co/NZmTrbLlXN',UK,0.13636363636363635,0.45454545454545453
2020-04-29 07:42:26,b'The villain uses our weaknesses the saint lifts our strength this demonstrates our imbalance our skewed perceptions\xe2\x80\xa6 https://t.co/x62CcwUjiV',"Los Angeles, CA",0.0,0.0
2020-04-29 07:40:51,b'@RT_com @WritesSweeney ooh- somebody else to blame #politics',,0.0,0.0
2020-04-29 07:40:11,"b""Lebanon's Bisri Valley Dam faces uncertain future after funding halt  https://t.co/M9mTIotor4 \n#economy #business\xe2\x80\xa6 https://t.co/edViTry2O0""",Abu Dhabi,0.0,0.125
2020-04-29 07:39:28,b'Villains teach us as much as saints they influence they inform our collective community and our individual tact on\xe2\x80\xa6 https://t.co/nA2N5mePwd',"Los Angeles, CA",0.1,0.30000000000000004
2020-04-29 07:39:12,"b'Lebanese banks set rate of 3,000 pounds per dollar for withdrawals from dollar accounts-sources - Reuters\xe2\x80\xa6 https://t.co/CMzwsAOO2i'",Abu Dhabi,0.0,0.0
2020-04-29 07:39:12,"b'Lebanon: The banking system needs reforms to stop the bleeding, not politics   https://t.co/HjQ5nNsBwJ \n \n#economy\xe2\x80\xa6 https://t.co/7oV3y0Kxjk'",Abu Dhabi,0.0,0.0
2020-04-29 07:31:33,"b'\xf0\x9f\x93\xa3 New Podcast! ""Miracle"" on @Spreaker #basketball #college_football #comedy #debate #film #football #fun #games\xe2\x80\xa6 https://t.co/rviTxhP7zk'","Greenville, SC",0.23522727272727273,0.32727272727272727
2020-04-29 07:30:07,b'Museveni attacks Police for arresting Zaake for distributing Covid-19 food and leaving NRM members who are illegall\xe2\x80\xa6 https://t.co/3BZHNthwBj',Uganda,0.0,0.0
2020-04-29 07:26:55,b'It\xe2\x80\x99s my birthday \xf0\x9f\xa5\xb3 + I\xe2\x80\x99m attending a morning webinar @StAlbansCOC from our local MP @libdemdaisy. \n\nDo I\na) get ext\xe2\x80\xa6 https://t.co/goCw7PpHB8',St Albans & London,0.0,0.0
2020-04-29 07:24:57,b'Have u evr thought : \n\nThe #left wing and the #right wing belongs to the same bird. \n\nYet we have to choose any one\xe2\x80\xa6 https://t.co/lr01nwuHB4',"Kolkata, India",0.09523809523809523,0.22023809523809523
2020-04-29 07:22:12,"b""If you have more faith and trust in the Joker and Hannibal Lecter over politicians, don't worry. You're normal.\xe2\x80\xa6 https://t.co/whE2NvQiZM""",Papua New Guinea,0.5,0.5
2020-04-29 07:19:49,b'13 prison guards contract COVID-19 https://t.co/yi7VmtUUoO\n#Bangladesh #Wuhan #Virus #Coronavirus #Claims #Lives\xe2\x80\xa6 https://t.co/Vy5FX0BUa8',Dhaka,0.0,0.0
2020-04-29 07:19:48,b'Krystal Ball: Is the #DropOutBiden movement gaining steam after new Tara Reade evidence emerges? | The Hill\xe2\x80\xa6 https://t.co/DStEO0xs6O',"Wide Bay, Australia",0.13636363636363635,0.45454545454545453
2020-04-29 07:19:34,b'84 contract COVID-19 in Narayanganj in a day https://t.co/HrH2zYgHki\n#Bangladesh #Wuhan #Virus #Coronavirus #Claims\xe2\x80\xa6 https://t.co/t3jAlwd5uY',Dhaka,0.0,0.0
2020-04-29 07:19:30,"b""Priti Patel probe findings should be made public 'as soon as possible' - Labour: The home\xe2\x80\xa6 https://t.co/SzEqWbiWWg #BBC #News #Politics""",United Kingdom,0.0,0.5333333333333333
2020-04-29 07:18:57,"b'Politicians and diapers must be changed often, for the same reason I believe. #Politics #wednesdaymorning'","Kolkata, India",0.0,0.125
2020-04-29 07:18:53,b'3/ Time for (parts) of the Israeli right-wing to stop cutting off their nose to spite their mouth and bad-mouthing\xe2\x80\xa6 https://t.co/f4aRQFsOzK',Jerusalem,-0.6,0.9
2020-04-29 07:18:28,"b'New Article: Trump hails U.S. coronavirus testing as infections cross a million \n\nhttps://t.co/lYyeeonpsP \n\n#Politics April 29, 2020'",ask why?,0.06818181818181818,0.22727272727272727
2020-04-29 07:17:41,b'1 lakh infection by May 31 projected https://t.co/WGRxGA6ENH\n#Bangladesh #Wuhan #Virus #Coronavirus #Claims #Lives\xe2\x80\xa6 https://t.co/IsT6LbFnzy',Dhaka,0.0,0.0
2020-04-29 07:17:25,b'People face hurdles in testing https://t.co/xBr0KLYf26\n#Bangladesh #Wuhan #Virus #Coronavirus #Claims #Lives #China\xe2\x80\xa6 https://t.co/FTKnp0fKc9',Dhaka,0.0,0.0
2020-04-29 07:17:07,"b'Coronavirus deaths top 214,451 https://t.co/69kwK8Biaj\n#Bangladesh #Wuhan #Virus #Coronavirus #Claims #Lives #China\xe2\x80\xa6 https://t.co/o5abBFg6Zd'",Dhaka,0.5,0.5
2020-04-29 07:16:49,b'COVID-19 patients at home missing from DGHS record in Bangladesh https://t.co/2Bybjj6PxF\n#Bangladesh #Wuhan #Virus\xe2\x80\xa6 https://t.co/tgUQ6ql06k',Dhaka,-0.2,0.05
2020-04-29 07:16:31,b'US govt details study on sunlight impact on coronavirus https://t.co/caJBqf24cq\n#Bangladesh #Wuhan #Virus\xe2\x80\xa6 https://t.co/L2oQ3OWOY8',Dhaka,0.0,0.0
2020-04-29 07:13:02,b'Over-65s and non-home workers now able to get coronavirus tests: Over-65s and those who need\xe2\x80\xa6 https://t.co/YPxqZfczve #SKY #News #Politics',United Kingdom,0.5,0.625
2020-04-29 07:10:48,"b'""They medicalize the #transsexuality issue. They say that transsexuality can be cured by sex change operations, but\xe2\x80\xa6 https://t.co/SWGozKKd20'",backstage,0.0,0.0
2020-04-29 07:08:06,"b'#JobAlert We are looking for an excellent researcher, preferably based in #Myanmar or South Asia to carry out a res\xe2\x80\xa6 https://t.co/ThAxQ2eWcV'",Myanmar - Europe,1.0,1.0
2020-04-29 07:07:33,b'The world is good because it is naked but it is not best because it is naked.\n#world #covid #corona #politics #man\xe2\x80\xa6 https://t.co/Xf5i5GxZu5',India,0.04999999999999999,0.42500000000000004
2020-04-29 07:05:39,"b""Compare the news side-by-side to see who's telling the whole story. Comment on bias or under-reporting. Share to su\xe2\x80\xa6 https://t.co/Lm9A8jgTzV""",,0.2,0.4
2020-04-29 07:03:26,b'Joe Biden\xe2\x80\x99s Possible Vice Presidential Candidates to Participate in Gun Control Series https://t.co/Zu7kiw8ckk #2a\xe2\x80\xa6 https://t.co/64gelQMfmh',,0.0,1.0
2020-04-29 07:02:50,b'NEW POST: Killer Italian Drama\n\nWill Italy ever be able to reopen Serie A? Or will drama reign instead?\n\n\xe2\x9e\xa1\xef\xb8\x8f\xe2\x80\xa6 https://t.co/ScurFnKNRq',"Southern California, USA",0.21212121212121213,0.35984848484848486
2020-04-29 07:02:16,"b""Its so hard to be political biased towards someone\nThose who are Anti #ImranKhan or Pro IK\nThey don't know how to r\xe2\x80\xa6 https://t.co/Hj5aBtyD5E""",I'm not Suppose to tell u that,-0.14583333333333334,0.3208333333333333
2020-04-29 07:01:39,b'WORST \xf0\x9f\xa4\x90 \n\n#Politics https://t.co/xICqLlk1wq',சென்னை,-1.0,1.0
2020-04-29 07:01:06,"b'This motherfu.....\n@algore is a delusional, hypocritical money-grabbing fraudster.\n\n#ClimateChange #ClimateHoax\xe2\x80\xa6 https://t.co/Sz5wPNirqY'",Socialist distancing.,0.0,0.0
2020-04-29 06:59:53,b'I know your a busy man @piersmorgan hope you keep up the good work make sure those politicians are held to account\xe2\x80\xa6 https://t.co/QVTehfZNgM',"London, England",0.4333333333333333,0.5962962962962963
2020-04-29 06:59:04,b'Ingraham: Are Americans starting to tune out blue state politicians? #politics #news #USPolitiHUB https://t.co/0L90ZrKLeS',,0.0,0.1
2020-04-29 06:57:54,b'What I Love About #America: #FreeSpeech @pensignal\n.@Medium #medium #blog #essay #news #politics #government\xe2\x80\xa6 https://t.co/kbtS4uCxb4',,0.5,0.6
2020-04-29 06:56:21,"b'..the commander-in-chief of the Joint Armed Forces \xe2\x80\x94 an umbrella for the army, the Revolutionary Guards and securit\xe2\x80\xa6 https://t.co/zjpesAKBSp'","Hyderabad, Sindh, Pakistan.",0.0,0.0
2020-04-29 06:55:33,b'\xf0\x9f\x92\xa5 I am so tired of racism \xf0\x9f\x92\xa5 \n\xe2\x9a\x96  #GreatAwakening \xf0\x9f\x91\x80\n\nBOMBSHELL: Uncovered Video Reveals Stacey Abrams Plotting Racist\xe2\x80\xa6 https://t.co/z8nyIsi0p7',"Wyoming, USA",-0.4,0.7
2020-04-29 06:55:00,"b'""There might be some serious fun in politics."" - Hunter S. Thompson\n#society #political #politicalmeaning #politics\xe2\x80\xa6 https://t.co/M75BRCrDlA'",,-0.011111111111111108,0.32222222222222224
2020-04-29 06:54:26,b'Hit the RESET button this Wednesday and Thursday. \xf0\x9f\x91\x8a #ResetEverything will explore the lasting impacts of #COVID19 i\xe2\x80\xa6 https://t.co/WskUtzflpI',🇩🇪🇦🇺🇳🇱,0.0,0.0
2020-04-29 06:52:50,b'Name and shame the politicians who have lied and only care about gaining political points add a name(s) to the list\xe2\x80\xa6 https://t.co/eEp9Exp9Pb',"London, England",0.0,0.55
2020-04-29 06:51:30,"b'#Chandigarh: 7 more test positive from Bapu Dham Colony, Sector 26; ... #7MoreTestPositive #BapuDhamColony\xe2\x80\xa6 https://t.co/sSfdmgGAMf'",Chandigarh,0.36363636363636365,0.5227272727272727
2020-04-29 06:49:00,"b'A panel of leading voices in the fields of #PublicHealth, #economics, and #politics ...\n\n#CornellUniversity\n\nhttps://t.co/hz0gwmu0iB'",Banjaluka,0.0,0.0
2020-04-29 06:44:39,"b""The #NewYorkTimes isn't backing down. \n\nhttps://t.co/oAHq0yxOtZ via @HuffPostPol\n\n#p2 #news #politics #coronavirus\xe2\x80\xa6 https://t.co/xGYfm007y5""",Somewhere in Y'all-land,-0.15555555555555559,0.2888888888888889
2020-04-29 06:44:33,b'DEEP State In Panic after Judge orders Michael Flynn\xe2\x80\x99s former attorneys to execute another search for documents aft\xe2\x80\xa6 https://t.co/oXRNjCRZlL',,0.0,0.2
2020-04-29 06:43:20,"b'If the #EconomicIntercourse fumble is not the sign for the Dems to intervene and do some kind of a reset, then I do\xe2\x80\xa6 https://t.co/gdK9XCp5Je'",,0.6,0.9
2020-04-29 06:40:40,"b""'You are an organisation of particular concern,' India dismisses #USCIRF's accusations on religious freedom\xe2\x80\xa6 https://t.co/Pznh6jA20v""",India,0.08333333333333333,0.29166666666666663
2020-04-29 06:40:07,b'\xe2\x80\x9cDo you like my socks?\xe2\x80\x9d Trudeau\xe2\x80\x99s embarrassing meeting with former Aussie PM Malcolm Turnbull\xe2\x80\xa6 https://t.co/X2zi2gn9EY',DC,0.0,0.0
2020-04-29 06:34:28,b'#Guidelines of Government of India for home isolation of very ... #GovernmentOfIndia #homeIsolation\xe2\x80\xa6 https://t.co/xctD866Uyz',Chandigarh,0.2,0.3
2020-04-29 06:34:12,"b'""China parliament to start key annual session on May 22"" Covered by 21 sources incl @YahooNews (Left) @Reuters (Cen\xe2\x80\xa6 https://t.co/dRxc6qpDM8'",,0.0,0.5
2020-04-29 06:34:08,b'Turkey: Emerging Identity https://t.co/6Dyg47uCaG #politics https://t.co/Akqj3qlQy0',"England, United Kingdom",0.0,0.0
2020-04-29 06:33:10,"b""Will Theresa May's boozy night out to a strip club lead to adverts on the BBC? #politics""",,0.0,0.0
2020-04-29 06:32:59,"b'U.S. and Venezuela Hold Secret Talks - WSJ on April 21, 2020 - please stay informed because this will impact the\xe2\x80\xa6 https://t.co/oJVpeXEPwI'",,-0.4,0.7
2020-04-29 06:32:57,"b""Ndorwa MP Niwagaba donates Covid-19 cash to sub counties, says whoever 'eats' the bonanza will be cursed by Ugandan\xe2\x80\xa6 https://t.co/WTI1cAAP5f""",Uganda,0.0,0.0
2020-04-29 06:31:51,"b'The #UK has failed us. The #media are failing us. @scotgov wants to hide away from #politics. Time for us, the peop\xe2\x80\xa6 https://t.co/C7tAqkbhC6'",,-0.15,0.2
2020-04-29 06:30:08,b'Brit Hume: Why the Case for National Lockdown Is Getting \xe2\x80\x98Weaker and Weaker\xe2\x80\x99 https://t.co/aNbvDLEChI #politics #thefederalistpapers',DC,0.0,0.0
2020-04-29 06:29:51,b'I absolutely stand with this. 100% \n#arpx #DemCast #DemCastAR #politics #resist https://t.co/uAuQqfsr29',,0.2,0.9
2020-04-29 06:25:39,b'@RonCashman A demonstration of the power of #Politics Not an unreasonable decision at the end of a tour of duty wit\xe2\x80\xa6 https://t.co/Rq7ABWnCvO',Lockdown will last for months,0.0,0.0
2020-04-29 06:24:37,b'Amritsar International Airport: Qatar Airways #Departed today morning: ... #AmritsarInternationalAirport\xe2\x80\xa6 https://t.co/I7webG4q8L',Chandigarh,0.0,0.0
2020-04-29 06:20:28,b'Live: Team Trump Online with Lara Trump and House GOP Leader Kevin McCarthy https://t.co/dhySRiiP9l #politics #rightsidebroadcastingnetwork',DC,0.13636363636363635,0.5
2020-04-29 06:19:27,b'Daily briefing: The death toll from coronavirus might be almost 60% higher than reported in official counts\xe2\x80\xa6 https://t.co/0qHhvV8tld',Somewhere in Y'all-land,0.125,0.25
2020-04-29 06:16:46,b'New Article: U.S. Senate leader opposes infrastructure spending in next coronavirus relief bill: Axios\xe2\x80\xa6 https://t.co/9CvZWw9gJt',ask why?,0.06818181818181818,0.22727272727272727
2020-04-29 06:15:04,"b'For political professionals: The difference between communication and fundraising is that if you can raise money, y\xe2\x80\xa6 https://t.co/I7bIomoj28'","Zurich, Switzerland",0.0,0.1
2020-04-29 06:14:04,b'Pence Blasted For Defying Mayo Clinic Face Mask Rule During Visit | The 11th Hour | @MSNBC\xe2\x80\x8b #USA #Trump #COVID19\xe2\x80\xa6 https://t.co/hShTitMPBB',Edmonton Alberta,-0.6,0.9
2020-04-29 06:12:20,"b'Always appreciate the time of my friend, Tauseeq! Gathered virtually to record a successful segment for\xe2\x80\xa6 https://t.co/bQjfTP2ZQe'","Saskatoon, Saskatchewan",0.75,0.95
2020-04-29 06:11:08,b'No mask for the Vice President? He asked for this song parody. https://t.co/sAXPFO7gGK #Politics #Liberal\xe2\x80\xa6 https://t.co/4eVXCDZdZy',Sierra Nevada Foothills,0.0,0.0
2020-04-29 06:10:20,b'@ABC Mainstream Media talking to the people..#politics #FearMongering #CorruptMedia https://t.co/AhEclr93F8',"Golden Horn, Turkey",0.0,0.0
2020-04-29 06:10:19,b'Leigh-Anne Pinnock to front documentary about [Video] https://t.co/TAvVBqWtFo via @360WiseMedia  #360WiseMedia\xe2\x80\xa6 https://t.co/RO0vdwrWCr',"Miami, FL",0.0,0.0
2020-04-29 06:09:08,b'British Airways to make 12000 workers redundant amid coronavirus crisis | ITV News - ITV News #politics\xe2\x80\xa6 https://t.co/QLnZ1oztfj',United Kingdom,-0.1,0.1
2020-04-29 06:09:06,"b""Zayn Malik and Gigi Hadid 'expecting first baby', family sources claim - Mirror Online #politics\xe2\x80\xa6 https://t.co/NxAhKxWNat""",United Kingdom,0.25,0.3333333333333333
2020-04-29 06:07:07,b'India slams USCIRF report on religious freedom violations - Hindustan Times #politics https://t.co/ZIkH8hNx6r https://t.co/fpOIt1Bo3q',India,0.0,0.25
2020-04-29 06:06:53,b'@NPR MSM talking to the people... #FearMongering #politics #CorruptMedia https://t.co/wGzEtFsk1y',"Golden Horn, Turkey",0.0,0.0
2020-04-29 06:05:35,"b""Trump's judges: a revolution to create a new conservative America \n\nhttps://t.co/JIFO3yFNJB\n\n#p2 #news #politics #justice #law #courts #RT""",Somewhere in Y'all-land,0.13636363636363635,0.45454545454545453
2020-04-29 06:01:22,b'https://t.co/BDatva0b9F ECB preview: time to wait? #macro #economics #politics',London,0.0,0.0
2020-04-29 06:00:16,b'Annual Press Freedom Rankings: Canada is #16 but America is #45? Where does China rank? https://t.co/pRDnpdWGm9 #politics #therebelmedia',DC,-0.8,0.9
2020-04-29 06:00:00,"b'#Politics #Maharashtra MVA, Opposition delegations meet Governor Koshyari, push their own agenda | reports @alokdesh https://t.co/uix7XxOS0q'","Mumbai, Maharashtra, India",0.6,1.0
2020-04-29 05:59:03,b'Justin Amash Moves Toward a Third-Party Bid for President #POTUS #politics #news #USPolitiHUB https://t.co/8G4zadGxyt',,0.0,0.0
2020-04-29 05:58:31,b'During Lockdown \n #NIRAVMODI #Politics https://t.co/uxHoOeffAx',Nagpur,0.0,0.0
2020-04-29 05:57:19,b'Chiti pledges efficient tax administration | Zambian Politics News - (Full Story: https://t.co/C6977mibUw ) #RT\xe2\x80\xa6 https://t.co/c9o24f5xBe',Zambia,0.35,0.55
2020-04-29 05:55:14,b'Smithfield Is a Symptom of #Trump\xe2\x80\x99s America\n\nhttps://t.co/X5H3jkNBd1 via @commondreams\n\n#p2 #news #politics\xe2\x80\xa6 https://t.co/OB0fG5M5Rl',Somewhere in Y'all-land,0.0,0.0
2020-04-29 05:52:30,"b'Gooood Night #Politics \n\nbut MostLy,\n\nThe People\n\n...\n\n#Progressives \n\n\xf0\x9f\x9a\x80\xe2\xad\x90\xef\xb8\x8f \n\n\xf0\x9f\x8c\x99'",,0.5,0.5
2020-04-29 05:50:25,b'Pence Declines to Wear Mask While Meeting With Mayo Clinic Patients https://t.co/qKHRHSIO1s #politics #theepochtimespolitics',DC,0.0,0.0
2020-04-29 05:48:12,b'It would seem as if engineers are not going to be able to rise without society\xe2\x80\x99s support and their involvement in t\xe2\x80\xa6 https://t.co/wbjf848XIC',,0.5,0.625
2020-04-29 05:48:05,"b'Hey all! Here\'s a post you might have missed! Read about...""Mental Health and Homelessness""\xe2\x80\xa6 https://t.co/yGKZTwdV91'",United States,-0.1,0.2
2020-04-29 05:47:13,b'Airlines and oil giants are on the brink. No government should offer them a l...\nhttps://t.co/tGYNsVL8ma\n+1 UKBot #UK #politics',Internet,0.0,0.0
2020-04-29 05:45:37,b'One last thought before I close my book and rest my eyes.\n\nThe one thing that differentiates a true community leade\xe2\x80\xa6 https://t.co/jJQs75iQpN',"Kansas City, MO",0.175,0.35833333333333334
2020-04-29 05:40:05,"b'Amid escalating tension, Oli faces secretariat meeting today\n#Nepal #politics \nhttps://t.co/wzLLuFyhd8 https://t.co/eVa8ziOWts'",Kathmandu,0.0,0.0
2020-04-29 05:37:45,"b'\xf0\x9f\x93\xa3 New Podcast! ""Hockey Time Episode 3. Ft Sam Laginski &amp; Ben Banfield"" on @Spreaker #canada #coronavirus #covid_19\xe2\x80\xa6 https://t.co/ATaL7RFsgu'","Guelph, Ontario",0.17045454545454544,0.45454545454545453
2020-04-29 05:37:24,"b'Lesotho amends constitution, piling pressure on PM to resign\n\n#Lestho #PM #PrimeMinister #TomThabane #Politician\xe2\x80\xa6 https://t.co/kxMOUy8TLd'",,0.0,0.0
2020-04-29 05:33:56,b'These are great numbers! Way to go Joe!  @JoeBiden\n.\n#VoteBlue2020 #Politics https://t.co/vbkKxrY5F6 https://t.co/3lEcqPqAqN',"Washington, DC",1.0,0.75
2020-04-29 05:32:17,"b""#World is suffering but the #political parties don't mind in doing  #politics. Visibly some #power hungry\xe2\x80\xa6 https://t.co/kFI4e60BCw""",India,0.0,0.1
2020-04-29 05:30:39,"b""Stefanie Condie: Trump's name is all over this catastrophe - Salt Lake Tribune #PoliticalViews #Politics\xe2\x80\xa6 https://t.co/JvlbNEGGPV""","Washington, DC",0.0,0.0
2020-04-29 05:25:37,b'A very thought provoking article about Thailand\xe2\x80\x99s situation now and the future. \n#Thailand #Politics #coronavirus\xe2\x80\xa6 https://t.co/NgjX4mj1Ad',,0.1,0.2125
2020-04-29 05:23:03,b'Governments raise spending on soldiers and weapons\n#politics #military #youth #young #teens #youthactivism\xe2\x80\xa6 https://t.co/yolnfB9UVd',,0.0,0.25
2020-04-29 05:22:21,b'Twitter #Politics and #Elections2020 https://t.co/u8AO8tXQJI',"Washington, DC",0.0,0.0
2020-04-29 05:20:34,b'@SkyNews Would the decision be driven by #politics or health based sound reasoning ?',,0.4,0.4
2020-04-29 05:19:36,b'Shahbaz Sharif is master of drama and showoff:Arif Nizami\nhttps://t.co/hvppJoZyOO\n\n#ShahbazSharif #ArifNizami #Pakistan #Politics #rava',Pakistan,0.0,0.0
2020-04-29 05:19:00,"b'@vivekagnihotri Answer is here :- She "" SONIA GANDHI "" never shown interest to become a #public #figure / #Politics\xe2\x80\xa6 https://t.co/sqRK3NjRwH'",INDIA- Agra / Anantapur,0.0,0.06666666666666667
2020-04-29 05:16:55,b'Former First Lady Hillary Clinton Endorses Joe Biden\xe2\x80\x99s White House Bid\nRead more: https://t.co/VS2mFgankA\xe2\x80\xa6 https://t.co/kBrTLZOWLU',,0.1875,0.20833333333333331
2020-04-29 05:16:44,b'Credibility is something you cannot buy with money. ~ Chanakya\n#\xe0\xa4\x9a\xe0\xa4\xbe\xe0\xa4\xa3\xe0\xa4\x95\xe0\xa5\x8d\xe0\xa4\xaf #\xe0\xa4\x9a\xe0\xa4\xbe\xe0\xa4\xa3\xe0\xa4\x95\xe0\xa5\x8d\xe0\xa4\xaf_\xe0\xa4\xa8\xe0\xa5\x80\xe0\xa4\xa4\xe0\xa4\xbf #being_chanakya #beingchanakya\xe2\x80\xa6 https://t.co/fsctqR0AAf',,0.0,0.0
2020-04-29 05:15:06,b'Is it safe to assume this is a senator from #Vermont? #movies #Politics https://t.co/j13r64hnHw',Isle of Shitpost Island,0.5,0.5
2020-04-29 05:14:34,b'Federal judges stop states from suspending elective abortions during coronavirus outbreak https://t.co/FQtutw1oZY \n   \n#Politics',At Your Fingertips,0.0,0.0
2020-04-29 05:13:21,"b'Stats, Expertise, and COMMON SENSE !!! This is long, but SO good! https://t.co/r9OkLpiYM7 via @YouTube #politics vs #medicine and #science'",the Wild Wild West,0.07968749999999998,0.5
2020-04-29 05:10:08,"b'Stephanopoulos Gets Scorched After Lecturing Dr. Fauci on Mass Testing Before Opening the Economy,\xe2\x80\xa6 https://t.co/L12oG9fLWA'",DC,0.0,0.0
2020-04-29 05:09:47,b'Very interesting read on our supply chain vulnerabilities: Think of coronavirus as a test runhttps://www.abc.net.au\xe2\x80\xa6 https://t.co/wfkGoWQ59M',Australia,0.65,0.65
2020-04-29 05:05:39,"b'""The real political battleground that Thailand will face in the not-too-distant future is the one between those who\xe2\x80\xa6 https://t.co/AGl1OSGAzu'",This is Thailand ,0.0,0.1375
2020-04-29 05:05:33,b'next Dr. Kelli Ward will probably suggest burning down hospitals to protest lockdowns. \n\nthis is one of the more de\xe2\x80\xa6 https://t.co/sN4D4qENfH',Somewhere in Y'all-land,0.11481481481481481,0.262962962962963
2020-04-29 05:03:20,"b""Nirmala Sitharaman rebuts Rahul Gandhi's claim, says no loan waived off\n\n#NirmalaSitharaman #Politician #Politics\xe2\x80\xa6 https://t.co/T0J65KqodH""",,0.0,0.0
2020-04-29 05:03:07,b'This 9-word tweet explains the Los Angeles City Council\xe2\x80\x99s love for resolutions better than any 5000-word story ever\xe2\x80\xa6 https://t.co/WB4RyKViGN',Los Angeles,0.5,0.55
2020-04-29 05:03:06,"b'When The Government Thugs Knock On Your Door, Ambush You In Public, Or Forceably Pull You Aside, Your Going To REAL\xe2\x80\xa6 https://t.co/4uwrkTcpLs'","Kansas City, MO",0.0,0.06666666666666667
2020-04-29 04:59:18,"b'Govt of India strongly lambasted the US Commission on International Religious Freedom (USCIRF), for placing India a\xe2\x80\xa6 https://t.co/YUUD7YmADA'","New Delhi, India ",0.14444444444444443,0.3277777777777778
2020-04-29 04:59:03,"b""Maybe... Pay People More,' Says AOC as Data Shows Half of US Workers Could Make More From Unemployment Than Low-Wag\xe2\x80\xa6 https://t.co/K36sLRdjsX""",,0.2777777777777778,0.38888888888888884
2020-04-29 04:58:09,b'READ:\n#NEWNORMAL #POLITICS https://t.co/dQxSjmJ5CG https://t.co/ORwQAAE3Uq',,0.0,0.0
2020-04-29 04:57:42,b'Would you rather mainline bleach with @realDonaldTrump or rub the leg hair @JoeBiden pool side? #politics',,0.0,0.0
2020-04-29 04:57:18,b'Trump Is Ready to Let Tyson Foods Work People to Death - New York Magazine #Politics #PoliticalParties\xe2\x80\xa6 https://t.co/hfX8PDxkmX',"Washington, DC",0.16818181818181818,0.4772727272727273
2020-04-29 04:55:33,b'Washington Post Frames Biden Assault Allegations As GOP \xe2\x80\x98Questions Of Behavior\xe2\x80\x99 https://t.co/SjGiGixAss #politics\xe2\x80\xa6 https://t.co/MaiIUpHr3A',United States,0.0,0.0
2020-04-29 04:54:34,b'President Trump tweets that \xe2\x80\x98Iran or its proxies\xe2\x80\x99 are planning a \xe2\x80\x98sneak attack\xe2\x80\x99 on US forces in Iraq https://t.co/LcIpmPxS4G \n   \n#Politics',At Your Fingertips,0.0,0.0
2020-04-29 04:48:12,"b'Page 1 headline in The Sun, the UK tabloid on April 9.\nCan we say the same about us? #coronavirus #COVID #pandemic\xe2\x80\xa6 https://t.co/NkaWncoTwd'",,0.0,0.125
2020-04-29 04:46:28,"b'Well, we all know that\xe2\x80\x99s a load of B.S.   Now this is what you would call \xe2\x80\x9cFake\xe2\x80\x9d news people! @realDonaldTrump @GOP\xe2\x80\xa6 https://t.co/6vGeogmEKi'",USA CANADA INTERNATIONAL,-0.625,1.0
2020-04-29 04:46:25,"b""@Alyssa_Milano Your #YearLong #Silence is a #Disgrace to the #MeToo #Movement don't #Act like you didn't know.\xe2\x80\xa6 https://t.co/MeB8leNLaE""","Brooklyn, NY",0.0,0.0
2020-04-29 04:43:03,b'First meme by me \xf0\x9f\x98\x82\n#ufo2020 #Israel #COVID19 #RSSinAction #BanRSS #Memes #Politics #political https://t.co/GeG1EneWjh',,0.125,0.21666666666666667
2020-04-29 04:42:50,"b'What is your opinion of the government chipping us. If you can, select a good point and a bad one, then reply in th\xe2\x80\xa6 https://t.co/aE1wcM78jq'","Illinois, USA",5.551115123125783e-17,0.6333333333333333
2020-04-29 04:42:27,b'A russian classic =)\nFallen - out of the window - down the staircase - into a bunch of knives...\n#politics https://t.co/erkcc0ooDl',,0.12777777777777777,0.36388888888888893
2020-04-29 04:41:49,"b'... \xf0\x9f\x93\xb0 ""Boris Johnson warns UK at moment of \'maximum risk\' from coronavirus (2020)"" https://t.co/fHwkzKLk9J - let me\xe2\x80\xa6 https://t.co/WbxbFaVsBc'",🇬🇧✈🇪🇺(🇲🇹),0.0,0.0
